Term	Title	Instance	Annotation
 vrouw 	'Ik ben altijd al een gekkie geweest'	‘Veel mensen denken over mij: die meid zat altijd overal, die zal het wel moeilijk hebben. Of: als iemand het in deze coronatijd slecht heeft, dan is dat Koen. Maar dat valt eigenlijk enorm mee. Het is anders dan anders, veel saaier. Ik vind het jammer dat festivals zijn afgezegd en dat een avond uitgaan niet meer is zoals het was. Maar ik ben iemand die het in principe overal naar z’n zin heeft. Ik werk wat meer vanuit huis en doe veel afspraken via videobellen, dat gaat prima.’ ‘Het is heel erg ingekakt. Ik presenteer een aantal shows bij MTV, die in de coronaperiode zijn afgezegd. Daarnaast ben ik best wel een socialite, wat betekent dat ik betaald krijg om naar bijvoorbeeld festivals te gaan, puur vanwege mijn aanwezigheid. Dat gaat allemaal niet door, net als de meet-and-greets en optredens die gepland stonden. Dit klinkt alsof ik een grote zangeres ben (lacht), maar ik heb gewoon een paar nummers gemaakt die ik weleens ergens zing, als een soort gimmick.’ ‘Ik ben ontdekt op straat, en dat was te gek natuurlijk. Daarna heb ik vier of vijf jaar modellenwerk gedaan, in onder meer Parijs en Milaan. Ik was nooit echt een big model, maar ook nooit slecht. Dat was helemaal fine, en ik heb waanzinnige dingen meegemaakt. In Milaan was het heftig, qua feesten en seks en noem maar op. Ik ben mezelf in die tijd een beetje kwijtgeraakt, ook omdat ik veel dingen van vroeger nog niet had verwerkt. Ik ben als kind erg gepest, wat nog best diep zat. In Parijs heb ik mezelf weer gevonden.’ ‘Op de basisschool, kinderen scholden me uit en deden naar. Het was zo erg dat ik in groep 6 ben geswitcht naar een andere basisschool, waar ik het wel fijn heb gehad. Maar toen ging ik naar het vmbo en begon het op de eerste dag weer. Op de basisschool had ik gezien hoe pijnlijk het voor mijn ouders was dat hun kind zo werd gepest. Ik weet nog dat mijn moeder een keer tegen een vriendin zei: “Als mijn kinderen gelukkig zijn, dan ben ik dat ook.” Toen het pesten op de middelbare school weer begon, heb ik thuis mijn mond gehouden en niks gezegd. Mijn moeder vond het achteraf heel erg dat ik daar in mijn eentje mee heb moeten dealen.’ ‘Elke dag was het anders, maar het was altijd vreselijk. Ik herinner me nog goed dat ze in december een aansteker hielden onder mijn gloednieuwe Moncler-jas. Huilend fietste ik naar huis, met mijn half-afgebrande jas om mijn schouders. Thuis deed ik alsof er niets aan de hand was en zei ik tegen mijn moeder: “Sorry, we hebben zo leuk met vuurwerk gespeeld, ongelukje gehad.” Dat was helemaal niet waar, maar dan kreeg ik gewoon op mijn kop zonder dat mijn moeder iets doorhad, en ging ik boven janken op mijn bed.’ Je ziet gewoon dat ik homoseksueel ben, dat was als peuter al zo ‘Ik ben anders, altijd al geweest. Ik was vrolijk, ik wilde altijd optreden, ik droeg de kleren die ik leuk vond. Je ziet gewoon dat ik homoseksueel ben, dat was als peuter al zo. Mijn moeder zei achteraf dat ze toen ik 2 jaar was al wist dat ik later met een jongen zou thuiskomen. Op het vmbo had ik als eerste Uggs, wat iedereen raar vond. Je ziet dat veel kinderen zich op zo’n moment aanpassen, en gaan doen wat de massa doet, maar ik ben blij dat ik dat nooit heb gedaan. Ik heb mijn eigen identiteit altijd omarmd, ook al werd ik daardoor gepest.’ ‘Ontzettend, vooral op school. Ik had e?e?n lieve vriendin, die er altijd voor me is geweest. Verder was er binnen en buiten mijn klas niemand voor me. Al mijn andere vriendjes zaten op een andere school, en ik had wat vriendjes op hockey, en een heel lieve broer.’ ‘Natuurlijk vond ik het lekker, ik wist dat ze me op covers van bladen zagen staan, en dat ze daarvan baalden. Dat gevoel heb ik lang gehad, maar ik heb dat inmiddels wel verwerkt door er met een professional over te praten. Het blijft een litteken op mijn hart, maar het is geen payback-time meer. ‘Vroeger wilde ik van alles worden, van kapper en acteur tot zeemeermin, als het maar lekker veel glam had en je er bekend door werd. Ik weet nog dat ik een keer in pyjama met natte, gekamde haren naast mijn moeder op de bank RTL Boulevard zat te kijken, en dat we Victoria Beckham ergens op een premie?re zagen paraderen. Ik riep: “Victoria, Victoria, dat wil ik later ook mam, dat ik over de rode loper ga en dat iedereen het dan over je heeft.” Dan zei mijn moeder: “Daar kom je wel op terug.” Ze had wel een beetje gelijk.’ ‘Ik denk dat iedereen dat wel een beetje heeft, toch? Ik vind het ook nog steeds leuk, maar soms is het net even te veel. Dan heb ik het vooral over privacy. Die is vanaf het moment dat je bekend bent gewoon weg, je kunt het niet uitzetten, ook niet als het niet uitkomt of als je even op jezelf wilt zijn. Dat is niet altijd leuk, en niet iedereen snapt dat, waardoor er niet altijd prettig op je wordt gereageerd.’ ‘Nadat ik was gestopt als model, ben ik de visagistenopleiding gaan doen. Ik vond make-up altijd al leuk, en heb daarna even gewerkt bij een luxe parfumerie in Hillegersberg. Vrij snel kwamen er mensen van een productiemaatschappij langs, die bezig waren met een realityserie over Rotterdamse jongeren. Drie mensen hadden los van elkaar tegen het productieteam gezegd dat ze mij in die serie moesten hebben, en zo kwam het dat ik het hoofdpersonage werd in het PowNed-programma Niet Lullen Maar Poetsen.’ ‘Er werd gedaan alsof ik een Quote 500-erfgenaam was, maar dat is niet het geval. Mijn vader is eigenaar van Electro World Van Dijk, waarmee hij goed heeft geboerd. We gingen altijd lekker op vakantie, ik liep in mooie kleding en we hadden een groot, mooi huis met een flinke tuin. Maar we hadden geen golfbaan, ook geen zwembad, en ik moest gewoon werken als ik iets wilde.’ ‘Super, ik kan niet anders zeggen. Ik heb liefdevolle ouders, van wie ik alles mocht wat ik wilde, en van wie ik mocht zijn wie ik wilde. Ook al was mijn vader veel aan het werk, mijn moeder en hij waren er altijd voor me. Ze hebben me enorm gesteund in alles, en nog steeds. Ze zijn ontzettend trots op me.’ ‘Tijdens de eerste aflevering van Niet Lullen Maar Poetsen slingerde Powned de hashtag “Koen Kardashian” de wereld in. Ik heb mezelf nog anderhalf jaar lang Koen Pieter van Dijk genoemd op Instagram, maar ik merkte dat mensen op straat allemaal zeiden: “Dat is Koen Kardashian.” In diezelfde periode leerde ik mijn inmiddels goede vriendin Anna Nooshin kennen, omdat ik haar een dag ging volgen voor mijn zelfbedachte MTV-programma #Instafamous. Zij had daar een Instastory van gemaakt, waarin ze mij had getagd als @koenkardashian. Ik zei: “Dat is een fan-account, je moet Koen Pieter van Dijk hebben,” waarop ze zei: “Schat, je wilt toch een brand neerzetten, dan moet je die naam veranderen.” Dat heb ik gedaan. Ik zie mezelf nu als een brand.’ ‘Nee, maar het is soms wel een truc. Ik ben altijd gewoon Koen, maar ik weet wat verkoopt en wat niet.’ ‘Het verkoopt niet als ik heel basic een boterham met pindakaas eet bij mijn moeder, maar het verkoopt wel als ik met een glas champagne in een chique ruimte zit te ble?ren.’ ‘Veel mensen denken: bij die Koen komt alles aanwaaien, hij stapt van een modellenleven over naar een realityserie en is nu presentator bij MTV. Zo is het ook allemaal gegaan, maar ik heb altijd keihard gewerkt en vaak genoeg zelf de stoute schoenen aangetrokken. Het is niet dat MTV mij heeft gebeld, ik heb zelf twee shows geproduceerd waarmee ik ze heb benaderd.’ ‘In het begin wel, toen ik net op tv was. Ik word nu veel meer gewaardeerd dan in die periode, er waren echt mensen die van me walgden, zo vreselijk vonden ze het. Mijn humor is behoorlijk droog, met veel zelfspot, dat snapt niet iedereen. Ik kreeg veel hatelijke berichtjes, wat ik voor mezelf nog wel dragelijk vond, want ik vind niet dat ik me hoef te verontschuldigen voor wat ik doe. Wat me pijn deed, was dat ik een keer met mijn moeder in de auto zat en dat ze begon te huilen, omdat ze zo baalde van alle kritiek op internet: “Ze moesten eens weten wat voor lekker kind je bent.” Ze maakte zich zorgen over mij, want ze wilde niet dat haar kind zich rot voelt. Dat effect heeft het op mij gelukkig niet meer zo. Ik zie het als een tekortkoming van die mensen als ze naar doen op social media. Het is niet mijn level, dus het interesseert me niet wat zo’n persoon van me vindt of over me zegt.’ ‘Tuurlijk lees ik weleens wat mensen over me zeggen op social media. Soms krijg ik er de slappe lach van, omdat het niet normaal is wat mensen allemaal voor onzin roepen. Maar het komt ook weleens voor dat ik ervan schrik. Een tijdje geleden ontving ik een vreselijk hatelijk berichtje van iemand met een open profiel, dat ik een schande was voor de gay-community, en dat elke homo zich voor mij zou moeten schamen. De toon was vreselijk naar en gemeen, dus ik ging even kijken van wie dat afschuwelijke bericht kwam en zag in haar bio staan: moeder van twee kinderen, werkend, sociaal pedagoog. Ik dacht: wow, nu pak ik je.’ ‘Ik heb eerst netjes op haar bericht gereageerd, dat werkt altijd lekker. Daarna heb ik een foto gemaakt van haar bericht en mijn reactie, en dat in mijn Instagram Stories gezet. Daarna heb ik haar foto en bio er ook bij gezet, met de tekst: “Jongens, ik schrik hier echt van, deze vrouw is moeder van twee kinderen en sociaal pedagoog. Ik vind dat de wereld moet zien dat dit niet kan en dat het gevaarlijk is voor de maatschappij.” Daarna ging het online helemaal los, iedereen vond het zo? bizar, en die vrouw was helemaal om: “Kan het eraf, kan het eraf.” Ze is daarna ontslagen.’ ‘Nee, nee, want het brengt ook veel leuke dingen met zich mee. Ik heb mooie reizen gemaakt, coole producties gedaan, leuke mensen leren kennen. Elke medaille heeft een keerzijde, en dat kan ik wel relativeren: dit moet je ervoor inleveren, dat krijg je ervoor terug. Dat is voor iedereen anders. Als ik naar mijn vriendin Estelle Cruijff kijk, en wat zij heeft meegemaakt, dan snap ik dat zij zegt: “Als ik het kon terugdraaien, dan zou ik dat doen.”’ ‘Ik noem het een truc, omdat ik weet welke kant van mezelf goed verkoopt, maar ik blijf altijd bij mijn authentieke zelf. Wat je ziet, is echt. Dit is wie ik ben. Toen ik klein was, trok ik al een omslagdoek van mijn moeder om me heen als jurk, met een pruik op en hakjes aan. Dan kwam ik naar beneden met rode lippenstift op en zei ik: “Hallo, ik ben Annelies Kattepies, wie zijn jullie?” Vervolgens ging ik weer naar boven, mezelf afschminken en me omkleden, en dan zei ik tegen mijn moeder: “Wie was dat rare wijf nou toch, die hier net was?” Ik ben altijd al een gekkie geweest, dat is mijn geheim.’ ‘Ik vind het vervelend als ik influencers spreek die zeggen: “Ik ben er zo? klaar mee, en dit en dat.” Soms durven ze zelfs het woord burn-out in de mond te nemen, en dan denk ik: meid, je moet niet vergeten dat je gewoon een foto van jezelf post, en daar 10k voor krijgt. Echt, doe even normaal, er zijn alleenstaande moeders die zich voor hun kinderen de tyfus werken voor een fractie van dat bedrag. Ik kan daar niet zo goed tegen. Dus nee, ik ben het nooit zat, omdat ik besef dat ik blessed ben dat ik op deze manier kan leven.’ ‘Ik ben weleens bang dat het allemaal wegvalt, en in het begin van de coronatijd heb ik wel wat paniekerige momenten gehad: o jee, alles wordt afgezegd. Ik ben ook niet goed in sparen, dat kan ik gewoon niet, dus ik heb geen buffer. Dan denk je toch even: wat nu?’ ‘Toen ik net bekend was, kwam er ineens best veel geld binnen, en kocht ik allerlei merkspullen. Balenciaga-shirts van 500 euro, dat soort dingen. Overal wilde ik het nieuwste van het nieuwste van. Dat is de laatste paar jaar heel erg veranderd. Ik hou van mooie dingetjes, en ik gun mezelf spullen die er goed uitzien, maar ik ben er niet meer zo intensief mee bezig als eerst. Als je zou uitrekenen waar ik het meeste geld aan uitgeef, dan is dat denk ik aan de horeca.’ ‘Dat is ooit begonnen met mijn lippen opspuiten en een beetje botox in mijn frons. Later zijn daar fillers in mijn jukbeenderen bijgekomen. Mensen denken vaak dat ik veel meer heb laten doen, maar daar is het bij gebleven.’ ‘Dat vragen veel mensen, en mijn moeder zegt ook vaak: “Hou eens op jongen, je bent al zo knap.” Maar het is maar net wat je mooi vindt, he?. Het heeft niks met ouder worden te maken, of met rimpels verdoezelen. Ik hou van de Hollywood-look, en een bepaalde vorm van perfectie. Dat is wat ik mooi vind, dus dat is ook wat ik bij mezelf wil. Dat bepaalde mensen me vroeger knapper vonden dan tegenwoordig, is hun mening.’ ‘Nee, dat begrijp ik eigenlijk nooit zo. Ik vind het zo Nederlands, mensen die kritiek hebben omdat iemand een beetje botox en fillers heeft. Ik zou andersom eens iets lelijks moeten zeggen over iemand die geen botox en fillers heeft, dan is de wereld te klein.’ ‘Het is goed dat er wordt uitgedragen dat iedereen er mag zijn, maar ik erger me dood aan hoe dat op Instagram gaat. Dan zet iemand een foto van zichzelf in een bikini met een vetrol online en is het meteen: “Dapper, stoer, you go girl.” Maar als je een keer een foto van jezelf plaatst waarop net te veel rib te zien is, dan is het van: “Jeetje, heb je anorexia, eet je wel goed?” Ik krijg dan de neiging om te reageren met: “Kijk naar jezelf, heb jij geen obesitas?” Dat vinden mensen dan grof en ongepast, maar iemand betichten van anorexia is wel oke?, terwijl dat een dodelijke ziekte is. Ik kan me daar zo? aan ergeren.’ ‘Ik hou van een afgetraind lichaam, dat is een look waar je voor kiest. En ik mag het niet zeggen, maar ik heb het liever te mager dan te dik. Ik vind Vivian Hoorn een lieve meid op Instagram, maar ze laat om de dag een vetrol of put zien. Dan denk ik: waarom? Maar een gekke bek trekken met je onderkin verkoopt tegenwoordig beter dan een lekker strak lookje.’ ‘Iemand die mij erg inspireert met haar manier van werken en hoe ze zichzelf blijft uitdagen, dat is mijn vriendinnetje Anna Nooshin. Ze is een zakenvrouw pur sang en zo’n harde werker. Mensen realiseren zich niet wat er allemaal komt kijken bij de dingen die ze doet.’ ‘Ik had eigenlijk maar e?e?n duidelijk doel, en dat was een boek uitbrengen met mijn verhaal. De afgelopen tien jaar, van mijn 17de tot mijn 27ste, waren best heftig. In mijn boek, dat later dit jaar in de winkels ligt, ben ik daar heel open en eerlijk over: mijn ups, downs, meest hysterische verhalen, verdriet, vreugde, struggles met drank en drugs. Het is spannend om alles op die manier open te gooien, maar ik zie het als therapie.’ ‘Ja, eigenlijk wel een beetje. Op naar de volgende tien jaar.’ Lachend: ‘Ik hoop dat de meeste hoofdstukken zich afspelen op een driedeksschip in Monaco. Je weet maar nooit.’ Waar? Vlakbij het huis van Koen, aan de Prinsengracht in Amsterdam. Nog iets genuttigd? Koen werkt een panini naar binnen en verontschuldigt zich veelvuldig voor het feit dat hij tijdens het gesprek eet, maar het is van eten eerder nog niet gekomen wegens afspraken en andere verplichtingen. We spreken elkaar om 15.00 uur, dus we snappen zijn hongerklop. Verder nog iets? Als je Koen alleen kent van tv en social media, dan is de associatie met hysterie, glitters en champagne snel gemaakt. Die kant zit ongetwijfeld in hem, maar op onze doordeweekse dinsdagmiddagafspraak is hij de relaxedheid zelve. Behalve een goede prater blijkthij een uitstekend luisteraar, hij heeft een gulle lach en een prettig uitgesproken e?n onderbouwde mening. Online onbeperkt lezen en Nieuwe Revu thuisbezorgd? Abonneer nu en profiteer! 	OFF
 vrouw 	Sylvie Meis pissig na commentaar op bikinifoto's: 'Bodyshamen jullie me?'	Sylvie Meis is absoluut niet te spreken over hoe het Duitse programma VIPstagram haar bikinifoto’s heeft besproken. In het programma worden de ‘eerlijke’ bikinicover van Linda de Mol en de foto’s van Meis vergeleken. Daarbij noemt presentatrice Tanja Bülter de kiekjes van laatstgenoemde ‘saai’, terwijl De Mol een inspiratie zou zijn voor andere vrouwen. Op haar Instagram Story reageert Meis woest op de opmerkingen van Bülter: „Ben je me nu aan het bodyshamen? Persoonlijk ken ik de presentatoren van dit erg onbekende format niet, maar laat me je dit vertellen. Ik ben 42 jaar oud en heb veel dingen in mijn leven overleefd. Ik werk hard aan mijn carrière en ja, ik werk ook hard in de sportschool. Omdat het me gelukkig maakt, níét omdat ik naar perfectie streef.” Meis zegt verder dat ze het ene lichaam niet ‘beter’ dan het andere vindt en respecteert elk lichaam zoals het is. „Ik houd van alle lichamen en respecteer elk lichaam genoeg om het in het openbaar te laten zien (zoals dat van Linda de Mol). Maar alsjeblieft: shame me niet omdat ik van mijn lichaam houd.” Sometimes in life a little distraction is just what’s needed… so here we go, Saint Tropez part two ?????? #vacay #bikinilife #summer2020 A post shared by Sylvie Meis (@sylviemeis) on Jul 30, 2020 at 10:13am PDT In het programma wordt bovendien een soort ‘strijd’ gesuggereerd tussen Meis en De Mol. „Linda de Mol staat voor haar imperfecte bouw. Ze zegt daarmee: ‘mensen, laat je niet gek maken. Jullie zijn misschien niet meer de jongsten, maar foto’s zoals een Sylvie Meis ze post zijn niet de maatstaf.’ In zoverre staat zij voor body positivity en moedigt daarmee andere vrouwen aan niet mee te doen aan deze ‘slankheidswaanzin’.” Bovendien stellen presentatoren Bülter en Kena Amoa dat De Mol in haar magazine uithaalt naar Meis, terwijl ze dat niet heeft gedaan. Eerder zei Meis wel dat ze vindt dat ze een jaloersmakend lichaam heeft. In een column in Grazia schreef ze in 2019: „Ik ben een veertigjarige vrouw met een lichaam waar menig 25-jarige toch naar zou kunnen kijken van: nah, zou ik ook wel willen.” Foutje gezien? Mail ons. Wij zijn je dankbaar. 	RAT
 vrouw 	Marieke Elsinga deelt body positivity-post - wel.nl	"Marieke Elsinga wil met haar nieuwste post op Instagram ""bijdragen aan een normaler zelfbeeld bij (jonge) vrouwen."" De 33-jarige presentatrice en ochtend-dj deelt in het bijschrift van een foto van zichzelf een verhaal over hoe ze voor een rol als ambassadeur van een bekend afslankmerk werd benaderd. ""Voor een nieuwe samenwerking zijn we op zoek naar mensen die de uitdaging aan willen gaan om van hun (corona?)kilo's af te komen. Wij zien een goede match met Marieke"", was een van de aanvragen die vorige week via haar mail binnenkwam. Marieke wuifde het eerst weg, maar dacht daarna pas na over de boodschap die het bedrijf indirect daarmee doorgaf. ""Er staat dus dat er bij mij wel wat (corona?)kilo’s af kunnen! Het bureau bedoelt het heus niet kwaad en ik sta redelijk stevig in mijn schoenen, maar wie zijn zij om dat voor mij te bepalen?"", vraagt ze zich hardop af. De presentatrice weet echter beter en hoopt haar (jonge) volgers te behoeden voor een misplaatst zelfbeeld. ""Mijn lijf is sterk en fit. ‘Hilversum slank’ ben ik misschien niet en daar zit volgens mij precies de kracht. Als we blijven doen alsof elke vrouw eruit moet zien zoals in de bladen of op tv, geven we e?cht het verkeerde signaal af. Aan onszelf en aan onze kinderen."" Marieke schrijft niet te vissen naar reacties als ""je bent perfect"" of ""je bent prachtig"", maar deelt het bericht met de hashtag #bodypositivity ""omdat ik wil bijdragen aan een normaler zelfbeeld bij (jonge) vrouwen. Iets waar ik zelf ook mee worstel."""	RAT
 vrouw 	"Model onder vuur nadat ze foto deelt van haar 'vetrolletjes': ""Sorry, ik ben niet zo slim"""	"Een Australisch model heeft kwaad bloed gezet met twee foto’s waarin ze een geposeerde en niet geposeerde houding aanneemt. Ze wilde daarmee bijdragen aan body positivity, maar haar volgers merkten op dat er amper verschil is te zien tussen beide foto’s omdat ze zo’n strak lichaam heeft.eval(ez_write_tag([[300,250],'metrotime_be-medrectangle-3','ezslot_3',150,'0','0'])); Belle Lucia is een Australisch model dat in Londen woont. De 25-jarige vrouw deelde donderdag twee foto’s met de bedoeling om body positivity te promoten door haar lichaam te durven tonen zoals het is. Op de tweede foto nam ze haar vetrolletjes vast, maar voor vele volgers is er daar bij haar amper sprake van, en dus kwam de boodschap voor velen averechts over. “Je had een minder flatterende pose kunnen aannemen, want op deze manier toon je jezelf als ‘bovenmenselijk’”, en “Deze boodschap zal heel wat mensen onzeker doen voelen”, klonk het onder meer. Overweldigd door de kritiek excuseerde Belle zich en verwijderde ze haar bericht. “Ik heb dit zonder slechte bedoelingen gedeeld. Ik wilde hetzelfde doen als alle mooie vrouwen die deze uitdaging aangaan. Ik wilde gewoon het verschil aantonen tussen een geposeerde en niet geposeerde foto van mezelf. Ik zie immers wel een verschil en ik voelde me zelfs onzeker om het te delen. Het spijt me enorm als ik iemand ermee boos heb gemaakt. Dat was helemaal niet mijn bedoeling. Ik zal de post verwijderen. Sorry”, schreef ze op Instagram. De kritiek en zelfs haatberichten bleven binnenstromen, dus probeerde Belle zich nogmaals te verdedigen. “Ik krijg heel wat haatberichten, waarschijnlijk verdien ik het, maar ik wil nogmaals herhalen dat ik geen slechte bedoelingen had met mijn bericht. Ik wilde niemand ermee kwetsen en ik zou nooit iemand opzettelijk willen raken. Ik ben een liefdevolle en vriendelijke persoon, maar ik ben van nature niet heel intelligent. Misschien begrijp ik het concept van body positivity niet zo goed, maar ik sta ervoor open om het te leren”, verduidelijkte ze.eval(ez_write_tag([[580,400],'metrotime_be-banner-1','ezslot_4',106,'0','0'])); Anderen vonden de kritiek dan weer onterecht. “Dames, wat is er gebeurd met women empowerment? Belle, je ziet er prachtig uit en je stelt je positief op, dus blijf doen waar je mee bezig bent”, en “Vrouwen zouden elkaar moeten aanmoedigen, niet bekritiseren”, klinkt het onder meer. A post shared by ?? B E L L E L U C I A (@belle_lucia) on Aug 27, 2020 at 12:17am PDT"	FAC
 vrouw 	Editie 193, augustus 2020: Lekker body positief - LINDA.nl	In dit nummer o.a.: Vanaf nu houden we op met zeuren. Linda de Mol staat op de cover in haar bikini om een punt te maken en stil te staan bij body positivity. Actrice Britte Lagcher is haar hele leven al vrijgezel en biecht over de liefde bij Mocro Maffia acteur Walid Benmbarek. Leuke man en rapper Sef over zijn nieuwe album, paniek aanvallen en rappen op latere leeftijd. Actrice Abbey Hoes showt bikini’s met haar billen in het zand. Maar ook: Katja Schuurman toont haar prachtige zwangere lichaam en vertelt over het moederschap en haar bipolaire stoornis. Zes bekende lijven kappen met de onzekerheid en poseren trots in bikini en een verlaten vrouw over hoe haar grote liefde tussen haar vingers weg glipte. LINDA. is de grootste vrouwenglossy van Nederland, van Linda de Mol. LINDA. is altijd spraakmakend en vernieuwend, met elke editie indrukwekkende interviews met bekende en onbekende mensen, eigenzinnige verhalen, herkenbare columns en het laatste nieuws op het gebied van mode en beauty.	OFF
