Term	Title	Instance	Annotation
 vrouw 	Tatjana Almuli duikt in het begrip body positivity	Journalist Tatjana Almuli duikt in de wereld van body positivity. Maar dat pakt minder florissant uit dan gehoopt. ‘Ik voel me mislukt omdat ik niet halfnaakt voor de spiegel dans.’ Nee, dan body neutrality, werkt stukken beter. Ik ben negen als ik voor het eerst geconfronteerd word met het heersende schoonheidsideaal. Samen met een paar vriendinnetjes bereid ik een act voor, we doen de Spice Girls na. We dragen staarten midden op ons hoofd, stiften onze lippen en knopen onze shirtjes net onder de borst zodat er een groot deel blote buik te zien is. Ik voel me net Sporty Spice, tot een vriendin het uitproest als ze me aankijkt en roept: ‘Ieuw, jouw buik is veel te groot voor zo’n topje! Jij bent geen echte Spice Girl, zij hebben namelijk platte buiken.’ Snel trek ik mijn shirt naar beneden, ik krijg het heel heet en moet bijna huilen: een enorme schaamte overvalt me. Vanaf dat moment raak ik geobsedeerd door mijn lichaam en uiterlijk. En wil ik koste wat het kost voldoen aan het ideaalbeeld dat ik overal terug zie komen in tijdschriften, reclames, films en later op sociale media. Ik wil die slanke, strakke, gladde vrouw zijn met een symmetrisch, gaaf gezicht en vormen op de goede plekken. Een vrouw die verzorgd, jeugdig en fris is en altijd blakend van energie. In haar boek Beyond Beautiful, A Practical Guide to Being Happy, Confident, and You in a Looks Obsessed World (2019) betoogt auteur Anuschka Rees dat we het conventionele schoonheidsideaal waarmee we in het Westen zijn opgegroeid hebben geïnternaliseerd. Waardoor ons uiterlijk een onmiskenbare waarde heeft gekregen. Die schoonheidsobsessie wordt gevoed door de media en vooral door industrieën die geld kunnen verdienen aan onze onzekerheden (zoals de dieetindustrie en grote opkomst van de plastische chirurgie). We halen zelfwaardering uit acties die in onze ogen bijdragen aan het voldoen of bereiken van dat conventionele schoonheidsideaal. Ben je vandaag naar de sportschool gegaan en heb je een salade gegeten als lunch? Dan vind je jezelf waarschijnlijk aantrekkelijker en een geslaagder mens dan wanneer je een zondagmiddag eindeloos series ligt te bingen op de bank. Ons zelfbeeld is volgens Rees vaak onlosmakelijk verbonden met ons positieve of negatieve lichaamsbeeld. Bij mij was dat ook heel lang het geval: ik dacht dat mijn leven pas zou beginnen wanneer ik veel was afgevallen. Dan zou ik een leuker, geslaagder, gelukkiger en succesvoller mens zijn. Het obsessief bezig zijn met mijn lichaam en willen afvallen heeft tot veel onzekerheid en gedoe geleid, waaronder een jarenlange eetstoornis. In mijn jeugd heb ik talloze afspraken met vrienden afgezegd omdat ik mezelf met hen vergeleek en altijd de mindere voelde. Ook heb ik me lang niet over kunnen geven aan liefdes- of bedpartners omdat ik dacht dat niemand mij aantrekkelijk kon vinden. En ik heb studie- en carrièrekansen laten lopen omdat ik dacht dat ik het niet waard was – allemaal door die allesoverheersende focus op dat uiterlijk. Tot ik daar vier jaar geleden helemaal klaar mee was. Vier jaar geleden kwam ik ook voor het eerst in aanraking met de body positivity-beweging. Deze stroming gaat uit van het idee dat ieder lichaam goed en mooi is zoals het is en dat schoonheid gevierd moet worden in alle soorten en maten. Mede dankzij deze beweging is er de afgelopen paar jaar iets veranderd in de eenzijdige, niet-diverse vertegenwoordiging van lichamen in het medialandschap. Dat begon in de VS toen plussize modellen als Ashley Graham en Tess Holliday geboekt werden door grote modetijdschriften en zelfs covers sierden. Barbiepoppen kregen nieuwe, meer inclusieve gedaanten en tv-series als Girls en Shrill werden goed bekeken door het mainstreampubliek. En natuurlijk speelt de komst van een app als Instagram een grote rol: je kunt volgen wie je wil en jezelf blootstellen aan meer verschillende vormen van schoonheid. Toe aan een tegengeluid en meer zelfacceptatie duik ik in de wereld van de lichaamspositiviteit: ik volg aanhangers en activisten, lees hun blogs en de boeken die ze aanraden. Ik luister podcasts en bekijk filmpjes waarin wordt verteld hoe je van jezelf leert houden. Het idee dat lichaamsvorm, huidkleur en (fysieke) bekwaamheid niet je waardigheid bepalen is een mooie gedachte, maar ook moeilijk te realiseren. Als je altijd is verteld dat je lichaam er niet mag zijn zoals het is en je dus net als ik die diepe zelfhaat kent, is het een moeilijke of zelfs onmogelijke taak om positief over dat lichaam te gaan denken. Ook voel ik opnieuw een druk: als ik na een jaar nog steeds niet van mezelf hou, voel ik me mislukt omdat ik niet zoals de helft van m’n Instagramfeed halfnaakt voor de spiegel dans. Daarbij focust de huidige body positivity-beweging vaak nog steeds op een bepaald type schoonheid, zo beargumenteert filosoof en journalist Heather Widdows in Psychology Today. Lichaamspositieve influencers en modellen zijn misschien voller, maar ze hebben nog steeds een prachtig symmetrisch gezicht, golvende haren en een egale huid. Ook zijn vrouwen met een witte huidkleur oververtegenwoordigd in de beweging en worden mensen van kleur nog steeds vaak uitgesloten. Niet alle lichamen worden dus even hard bejubeld. En misschien nog wel de belangrijkste reden waarom ik mijn geluk uiteindelijk niet vind in de ideeën van de lichaamspositieve stroming: het gaat nog steeds hoofdzakelijk over dat uiterlijk. En dat ben ik nu net zat. In 2018 lees ik voor het eerst over body neutrality in The Independent. Journalist Rachel Hosie beschrijft dat je volgens dit concept de focus legt op wat je lichaam allemaal voor je doet in plaats van je te richten op esthetische kenmerken. Om je uiterlijk een minder belangrijke rol te geven is het idee dat je niet vanuit dat geïndoctrineerde schoonheidsideaal naar je lichaam kijkt, maar eerder vanuit functionaliteit. Het maakt niet uit in welke staat van zijn je verkeert, of je gezond of minder gezond bent, of je een beperking hebt of niet, jong of oud bent, dik of dun: je kunt altijd wel iets vinden waar je lichaam toe in staat is. Mijn benen bijvoorbeeld dragen me elke dag, ik kan kilometers achter elkaar lopen en fietsen, veel gewicht squatten en deadliften in de sportschool en ze zijn flexibel tijdens moeilijke yogaposes. Ze maken het mogelijk dat ik een nacht lang zwetend sta te dansen op een feest en seks heb met mijn partner. Not too lousy als je het mij vraagt. Volgens Rees, de auteur van Beyond Beautiful helpt het neutraler kijken naar je lichaam uiteindelijk om minder focus te leggen op je uiterlijk waardoor je een gezonder lichaamsbeeld ontwikkelt. Dat is iets waar actrice en activist Jameela Jamil ook in gelooft en voor strijdt met haar (sociale)mediaplatform en community I Weigh, dat online al meer dan een miljoen aanhangers heeft. Ze roept mensen op om een selfie te plaatsen met daarbij kenmerken van zichzelf en dingen die ze belangrijk vinden in hun leven, los van uiterlijkheden. Een paar voorbeelden uit haar eigen rijtje: ik ben financieel onafhankelijk, ik lach iedere dag, ik kom op voor vrouwenrechten, ik hou van mijn baan, ik heb een liefdevolle relatie en fantastische vrienden. 'Nu ben ik de meeste dagen oké met mijn spiegelbeeld. Terwijl er niets is veranderd qua uiterlijk.' Ik ben nu iets langer dan een jaar bezig met het beoefenen van lichaamsneutraliteit. Voor mij heeft het functioneel denken over mijn lichaam veel betekend, het maakt me vaak dankbaar. Ondanks al die lelijke gedachten en gevoelens door de jaren heen is mijn lijf nog altijd sterk en gezond. Als ik nu nog eens verval in die zelfhaatgedachten, experimenteer ik met lichaamsneutrale affirmaties uit Beyond Beautiful. Een voorbeeld: hoe ik me nu voel heeft niets te maken met mijn uiterlijk. En: ik ben meer dan mijn lichaam, het is maar één onderdeel van mij als persoon. Grappig genoeg heeft het uiteindelijk ook veel gedaan voor mijn zelfacceptatieproces: ik ben de meeste dagen oké met mijn spiegelbeeld. Terwijl er niets is veranderd qua uiterlijk. Door deze nieuwe manier van denken vergelijk ik mezelf minder met anderen – zowel online als offline. Ik hoef geen bepaald gewicht, bepaalde kledingmaat of mate van gespierdheid te bereiken. Dat geeft veel rust en vrijheid. En er blijft vooral meer ruimte en tijd over om met echt belangrijke zaken bezig te zijn en dromen en doelen te vervullen nu ik niet meer constant bezig ben met de manier waarop ik eruitzie. En dat gun ik iedereen. Om met een bekend citaat van comédienne Sarah Silverman te eindigen, een klein beetje vervormd naar de lichaamsneutrale way of life: Mother Teresa didn’t obsess about her thighs: she had shit to do. Dit artikel verscheen oorspronkelijk in het meinummer van ELLE, waarin we (zelf)liefde vieren. Wie 'm online bestelt krijgt hem zonder verzendkosten thuisgestuurd. Wel zo makkelijk. Samsøe & Samsøe, € 99 Arket, € 115 Chanel, € 26 Mango, € 79,99	FAC
 vrouw 	Body positivity alleen niet genoeg: tijd voor mind positivity	"Kijk milder naar je lijf en wees zachter voor je geest. Dat is het devies van druktemaker Ellen Deckwitz. ""Het is zomer, tijd om te bloeien, tijd voor zowel Body, Ã¡ls Mind Positivity"", zegt ze in De Nieuws BV. Nederland was afgelopen week van slag: Linda de Mol stond in haar bikini op de cover van haar eigen blad. ""Ze deed dat onder het motto van body positivity wat velen emotioneel niet aankonden en dus regende het online klachten,"" zegt Deckwitz, ""dat de cover gephotoshopt moest zijn, dat het Linda gewoon om de aandacht ging, dat iemand van haar leeftijd alleen nog maar in een habijt mag rondlopen, en zo vormde een goedbedoeld statement het zoveelste excuus om iemand af te zeiken."" Deckwitz: ""En dat is zonde, omdat body positivity in principe een bijzonder gezond idee is. Bij body positivity gaat het er simpelweg om dat je het lichaam, zowel dat van jezelf als dat van anderen, waardeert en accepteert zoals is. Niet meer, niet minder. Dat het lijf er gewoon mag zijn."" Naast body positivity pleit Deckwitz voor Mind positivity. ""Wat ik jammer vind, is dat het bij body positivity alleen om het lichaam draait, terwijl we ook de binnenkant zouden mogen omarmen, iets wat anno 2020 nog steeds niet vanzelfsprekend is."" ""We leven in een wereld die niet alleen onhaalbare eisen stelt aan ons uiterlijk, maar ook aan ons innerlijk. Van kindsbeen af aan worden we gedrild in wat voor persoon we zouden moeten zijn, en maken we niet alleen kennis met een schoonheidsstandaard, maar ook met een mentale standaard. Eentje waarbij je als man je gevoelens en kwetsbaarheden voor jezelf moet houden omdat je anders een watje bent, eentje waarbij je als vrouw niet al te assertief mag zijn omdat je anders een bitch bent."" Deckwitz: ""En zo leren we ons te schamen voor gedragingen die niet meer dan menselijk zijn. Haten we onszelf om onze somberte en angsten, minachten we onszelf wanneer we op een slechte dag door woede worden overvallen, zeggen we aan de lopende band sorry wanneer we huilen."" ""Laten we onszelf leren blootgeven zonder schaamte, laten we minder moeilijk doen. Het is zomer, tijd om te bloeien, tijd voor zowel body, Ã¡ls mind positivity."" Volg ons op Instagram, Facebook en Twitter."	RAT
 vrouw 	Met deze tips van de 'Damn, Honey'-vrouwen ga je écht van jezelf houden	Van jezelf houden is niet voor iedereen van nature even makkelijk. Zeker als vrouw krijg je al jarenlang voorgeschoteld hoe je eruit moet zien, welke maat je zou moeten hebben en wat je daarvoor (niet) moet eten. Nydia van Voorthuizen (links op de foto) en Marie Lotte Hagen, de auteurs achter het pamflet DAMN, HONEY zijn daar klaar mee. Linda de Mol poseert in bikini op de cover van de nieuwe LINDA. Want driekwart (!) van de Nederlandse moeders staat niet of nauwelijks op haar eigen vakantie­foto’s, blijkt uit onderzoek van LINDA.nl. In het kader van body positivity maakt Linda daar een punt van. Hagen: “Vroeger waren we afhankelijk van castingbureaus en redacties die bepaalden wat we te zien kregen op tv en in tijdschriften. Maar met de komst van social media bepaal je voor een groot deel zelf wat je ziet. Dus: weg met alle accounts waarvan je een negatief gevoel krijgt. Nydia houdt van hardlopen, maar werd helemaal gek van alleen maar foto’s van fitgirls. Dus die heeft ze eruit gekieperd. Ook hebben we allebei best wel wat vrienden ontvolgd, omdat we zelf ongelukkig werden van hun foto’s. Zie je foto’s waar je een negatief gevoel aan overhoudt? Weg ermee.” “Deze tip is net zo belangrijk als de eerste. Door te masturberen leer je je lichaam heel goed kennen, je valt er lekker bij in slaap, het helpt tegen stress en het helpt tegen menstruatiekramp. Er zijn alleen maar voordelen, dus neem er goed de tijd voor. Maak het bijzonder, zet een muziekje op of gebruik glijmiddel. Je raakt er meteen een stuk onzekerheid over sex door kwijt.” Lees ook Esther (23) over haar laatste orgasme: ‘Terwijl hij ging douchen, hielp ik mezelf’ “Zijn er kledingstukken waar je een rotgevoel van krijgt? Misschien omdat ze je eraan herinneren dat je niet het lijf hebt waar je naar streeft? Doe ze weg. Ik heb jarenlang de shape wear uit mijn zelfhaatperiode bewaard – uit angst dat ik het weer eens nodig zou hebben. Ergens klonk een stem die zei: ‘Je bent niet genoeg.’ Het is het meest bevrijdende gevoel ever om die zooi weg te gooien.” “Weiger je jezelf wel eens dingen? Ik zette mijn leven jarenlang on hold. ‘Als ik 15 kilo ben afgevallen mag ik naar feestjes, ga ik flirten en mooie kleren kopen’, hield ik mezelf voor. Ik ontzegde mezelf allerlei dingen omdat ik ‘nog niet goed genoeg’ was. Toen ik die houding overboord had gegooid, werd ik daar een stuk gelukkiger van. Ontzeg jezelf dus niets, maar laat jezelf zien aan de wereld.” “Dan hebben we het vooral over de uren die we tegen de spiegel aangeplakt staan om iedere porie, rimpel en pigmentvlek te bestuderen en te haten. Een vrouwenlichaam kent géén probleemzones, er is niet één lichaamstype dat we allemaal zouden moeten hebben. Stop dat te denken, het is zonde van je tijd. Gebruik die tijd vooral om de dingen te doen die je leuk vindt. En áls je in de spiegel kijkt, doe dat dan vooral om te dansen, te knipogen en jezelf handkusjes te geven. Om tegen jezelf te zeggen: je bent een tof mens.” “Klinkt heel makkelijk, maar is het niet. Je moet immers wel weten waar je gelukkig van wordt. Als je al je leven lang anderen pleaset en nooit stilstaat bij wat jóu gelukkig maakt, kan het je gaan duizelen om te bedenken waar jij gelukkig van wordt. Maak er anders eens een project van om dat te ontdekken. Ik wist tot mijn 28e niet dat ik lesbisch ben. Daarna pas viel alles op zijn plek. Ik werd zelfverzekerder en wist veel beter wat ik wilde, want nu wist ik wat mij gelukkig maakte.” “De gedachten die je hebt over anderen zeggen vaak meer over jezelf dan over een ander. Praat eens bewust positief, dat verandert iets aan je houding. Hoe je dat doet? Begin met positieve woorden gebruiken. Of betrap jezelf op negatieve gedachten over een ander. Die zijn namelijk niet goed voor je eigen gemoedsrust.” “Heb je het wel eens over ‘zondigen’, als je bepaalde dingen eet? Voel je je wel eens schuldig over iets wat je eet? Eten is maar gewoon eten. Soms heb je zin in een vette hap, soms heb je zin in broccoli. Geniet van allebei.” “Een saunabezoek is heel relativerend, daar zie je pas echt goed dat een lijf -hoe dun, dik, oud, jong het ook is- gewoon een lijf is. Het geeft je een realistisch beeld van lijven dan wanneer je door een tijdschrift bladert.” “Zeg vaker tegen jezelf en anderen dat je de leukste baas bent, de coolste moeder, een lekker wijf. Te vaak houden we vast aan ‘doe maar gewoon, dan doe je al gek genoeg’. Maar je mag best trots zijn op jezelf. Houd van jezelf, ook op de dagen dat je geen reet doet. Je hoeft geen baanbrekende dingen te doen of te bereiken om je goed te mogen voelen over jezelf.”	EMO
