Publication Date	Time	Publisher	Author	Title	URL	Text
13-12-2019	08:00:00Z	FOCUS Online	FOCUS Online	"Fatshaming bei Babys: Hebamme klärt auf: ""Fette Babys gibt es nicht!"""	https://www.focus.de/familie/eltern/aus-der-community/phaenomen-fatshaming-fatshaming-bei-babys_id_11105709.html	"Babys sind bekannt für ihre Speckröllchen, Pausbäckchen und Michelin-Ärmchen. Dennoch wird Müttern immer wieder unterstellt, ihr Kind sei übergewichtig und sie seien schuld daran. Hebamme Aleyd von Gartzen erklärt, warum das einfach nicht stimmt. Die erste Zeit mit Baby ist für viele Eltern eine Zeit der Unsicherheit. Alles ist neu und ungewohnt - oftmals wissen frischgebackene Mütter und Väter selbst nicht, ob sie alles richtig machen. Ungefragte Ratschläge oder Anmerkungen von Mitmenschen - egal ob lieb gemeint oder nicht - streuen häufig mehr Salz in die Wunde, als dass sie etwas bringen. So auch beim Thema Gewicht. Denn offenbar ist halten manche Menschen Babyspeck nicht für süß und natürlich, sondern für ein Anzeichen von Übergewicht. ""Meine Schwiegermutter fand damals bei der Großen - die wirklich kein 'dickes' Baby war -, sie hätte fette Beine und sei sehr rundlich"", erzählt etwa Mutter Froschy in der NetMoms-Community. Auch wenn ihre Schwiegermutter es nicht so meinte, wie die Userin deutlich macht, musste sie bei solchen Aussagen schlucken. ""Ich finde es traurig, dass sie es so sieht. Mein Baby ist im absoluten Normalgewicht und ich möchte diese Äußerungen nicht mehr hören."" Auch NetMoms-Userin Skipi94 erzählt: ""Meine ehemalige Arbeitskollegin hat es zwei Mal fertig gebracht, sich über die 'dicken Schenkel' meines Sohnes zu amüsieren."" Und Hakunamatatamama erinnert sich, dass ihre Tochter als Baby ""ständig als dick (und bösere Wörter) betitelt"" wurde. Und das ungefragt, ohne ein Hallo vorweg - ""anstandslos"", findet die Mutter. Ein Blick in Mütterforen außerhalb Deutschlands verrät: Es geht noch doller. So wandte sich etwa eine eine junge Mutter ratlos an die MumsNet-Community, nachdem sie wiederholt Kritik am Gewicht ihres Babys über sich ergehen lassen musste. Hilfesuchend schickte sie ein Bild ihrer Tochter in die Community und fragte: ""Sind diese Beine zu fett?"" Eine Mutter wusste nach ähnlichen Erfahrungen ebenfalls nicht weiter - beschloss dann aber die Reißleine zu ziehen und die Kritiker in einem offenen Brief zu konfrontieren. Auf Refinery29 titelte sie ihren Gastbeitrag folgendermaßen: ""Hört auf, mein Baby zu fatshamen!"" Denn wie solle sich ihre Tochter fühlen, wenn sie verstünde, was diese Menschen gesagt hatten? Fatshaming bei Babys - dass es das wirklich gibt, kann Aleyd von Gartzen nicht nachvollziehen. Sie ist Bundesbeauftragte für Stillen und Ernährung des Deutschen Hebammenverbands und in all den Jahren als Hebamme ist ihr noch nie ein übergewichtiges Baby untergekommen. Sie weiß: Speckröllchen, Pausbäckchen und Michelin-Ärmchen sind von der Natur so erdacht - und damit an Babys vollkommen normal. Wie also kommen Menschen auf die Idee, Babys vorschnell als ""zu dick"" zu bezeichnen? Weil sie es nicht besser wissen. Oder wussten Sie, dass gestillte Kinder häufig deutlich mehr zunehmen als nicht gestillte Kinder? Für gewöhnlich verdoppeln sie in den ersten vier bis fünf Monaten sogar ihr Gewicht. ""Da kann man sich schon vorstellen, dass die ein oder andere Speckrolle dabei ist"", sagt von Gartzen und lacht. Tatsächlich wirke Stillen sogar präventiv gegen Übergewicht, erklärt die Hebamme. Mütter können bei dieser Art der Ernährung folglich nichts falsch machen, übrigens auch nicht bei Pre-Nahrung. Ein zu dickes Baby? Wenn es gestillt wird, gibt es das selten. Bei der sogenannten ""Folgenahrung"" liege die Sache schon anders. Hier sollten Eltern aufpassen, dass sie ihr Kind nicht überfüttern. ""Sie tun das sicher nicht bewusst. In der Realität kommt es aber doch vor, dass Babys zu viel zu essen gegeben wird. Nämlich dann, wenn Eltern zu viel auf ungesunde Produkte der Babynahrungsindustrie zurückgreifen und dem Baby mehr geben als empfohlen wird. Zum Beispiel, wenn ein Gequengel immer als ein Zeichen von Hunger gedeutet wird."" Dass Produkte für Babys nicht immer gesund sind, zeigte kürzlich auch Stiftung Warentest. Ein Test von 19 Getreidebreien für Babys ergab: nur drei sind nicht vollkommen zuckerhaltig. Mit Aromen, Zuckerzusätzen und Empfehlungen, den Brei schon ab dem viertem Monat zuzufüttern, würden Eltern unnötig in die Irre geführt. ""Hersteller fördern den Kontakt mit Süßem"", lautete das Fazit der Stiftung Warentest. Bringt der Nachwuchs viel auf die Waage, ist das trotzdem erst einmal nicht besorgniserregend. ""Das deutlich größere Problem bei Babys ist eine geringe Gewichtszunahme"", schildert von Gartzen eine Sorge, die sie mit ihren Kolleginnen teilt. Eine Gewichtsabnahme von fünf bis sieben Prozent sei zwar bei Neugeborenen normal. Anfangs achte man dennoch darauf, dass sie nicht zu viel Gewicht verlieren, da sie mehr ausscheiden als sie an Nahrung zu sich nehmen können. Aufgrund dessen haben Hebammen - und Kinderärzte bei den U-Untersuchungen - darauf ein besonderes Augenmerk, wie von Gartzen betont. Eine große Hilfe für Mütter in dieser Zeit seien daher Hebammen, weiß von Gartzen. Zum einen, weil sie auf die Sorgen der Mütter eingehen und Zweifel beiseiteschieben können. Zum anderen, weil sie die Familien über Monate begleiten und sie in dieser Zeit auch zu einem gesunden Ernährungsverhalten beraten können. Diese Aufgabe sei ganz besonders wichtig, denn gesunde Ernährung diene allen, nicht nur den Babys. Zum Beispiel, wenn es um das Thema Beikost geht, das bei Babys mit ungefähr sechs Monaten ansteht. Hier sei es gut zu wissen, dass der Nachwuchs sich dann schon vor allem für das Essen der Eltern interessiere. ""Sie sind neugierig und wollen alles probieren."" Gibt es häufig Nachtisch, wird auch das Baby - allein aus Neugier - danach verlangen. ""Eine Einschränkung des Zuckerkonsums ist spätestens dann ratsam. Mütter und Väter sollten von Anfang an ein gutes Vorbild für ihr Baby sein."" Dieses Umdenken dürfe gerne auch früher schon geschehen, etwa in Schwangerschaft und Stillzeit. Denn Babys nehmen über Plazenta und Muttermilch das auf, was Mama isst und seien dann auf bestimmte Lebensmittel oder Geschmäcker ""geprägt"", erklärt die Stillbeauftragte. Hier können Mütter also bereits beeinflussen, ob ihr Baby später beim Füttern von Beikost eher auf Süßes oder auf Gemüse anspringt. Lesen Sie mehr zum Thema: Übergewicht beim Kind: 10 Dinge, die Eltern tun können Wer keine Kinder hat, macht sich in den seltenen Fällen über Gewichtstabellen für Babys schlau. Daher ist es von Gartzen ein Anliegen, dass zumindest Eltern ganz genau wissen, was bei Babys normal ist. ""Wenn Mütter ausreichend informiert sind, wissen sie besser, wie sie sich verhalten können"" - etwa, wenn Fremde, Verwandte oder Freunde mit unangebrachten Babyspeck-Kommentaren ankommen. So halten es auch die Mütter aus der NetMoms-Community. Skipi94 ergänzt beispielsweise: ""Mir persönlich ist es egal, was die Leute sagen. Ich konnte ja keinen Säugling, der ausschließlich Pre-Nahrung bekam, auf Diät setzen..."", gefolgt von einem lachenden Emoji. Auch Hakunamatatamama schreibt entschieden: ""Ich weise [dann] darauf hin, dass ich die Mutter bin und am besten weiß, was für meine Tochter gut ist. Wenn ich nicht um Hilfe bitte, brauche ich auch keine und dann soll man sich um seinen eigenen Kram kümmern."" Vielen Dank! Ihr Kommentar wurde abgeschickt. Im Interesse unserer User behalten wir uns vor, jeden Beitrag vor der Veröffentlichung zu prüfen. Als registrierter Nutzer werden Sie automatisch per E-Mail benachrichtigt, wenn Ihr Kommentar freigeschaltet wurde. 11.09.19, 11:58 | Helga Alex Ich selbst bin 1,60 gross und wog damals gegen Ende der Schwangerschaft 68 kg. Nachher nahm ich wieder auf 50 kg ab. Aber bei jedem Kind blieben 2 kg drauf. Meine Kinder sind beide schlank und waren es auch als Kleinkinder. Nur ich selbst habe im Laufe der Zeit ca 20 kg zugelegt. 11.09.19, 11:18 | Barbara Beier Mütter mit Normalgewicht, die ein mehr als rundliches Baby spazieren fahren. Massenweise dagegen welche, wo das arme Kind Mühe hat, überhaupt noch in die Karre zu passen. Die Mütter dazu sehen wie die große Ausgabe des Kindes aus, unästhetisch schwabbelnd. Und ja, das allgemeinen ""Niveau"" der Mamis ist durchaus sichtbar... 11.09.19, 09:06 | Susi Marillion Wurde mit rund 4500 Gramm geboren und war schon immer extrem verfressen. Das ist er such 24 Jahre später noch, allerdings ist er 1,90 m groß, gut trainiert und trägt Größe S Magerwahn bei Säuglingen, dieses Zeitalter ist schon sehr absurd 10.09.19, 15:37 | Sabine fürst | 3 Antworten es eindeutig mehr dicke Babys. Ich habe mein Kind 1983 bekommen. Die allermeisten Babys haben durchschnittlich 3,5 Kilo gewogen. War völlig normal. Heute wiegen sie im Schnitt 1 Kilo mehr. Heute sind aber auch überproportional viele Mütter von hause aus Übergewichtig. Dementsprechend essen sie in der Schwangerschaft und nehmen streckenweise bis 30 Kilo zu. Wenn damals eine Schwangere 20 Kilo zugenommen hat, war das viel. Zwischen 12-15 Kilo war die Norm. Aufgrund meiner Beobachtungen, in den letzten 35 Jahren, behaubte ich...dicke Mütter, dicke Babys. So wie es zu einen erheblichen Prozentsatz stimmt..dicke Eltern, dicke Kinder. Würde auch erklären, warum die heutigen Kinder ständig krank sind. 11.09.19, 15:52 | Sabine fürst sagen Frau Gramsch . Ich arbeite seit 30 Jahren ausschließlich mit Frauen zusammen. Dadurch sehe ich relativ viele Babys. Nach meiner Beobachtung gebären sowieso schon dicke Frauen dickere Babys. Das Schwerste wog 5,2 Kilo. Die Mutter Normalgewicht 112 Kilo. Gewichtszunahme während der Schwangerschaft 27 Kilo. Da besteht ein Zusammenhang. Mutter und Embryo sind schließlich verbunden. 10.09.19, 12:55 | Alexandra Eberer es kommen halt nicht alle Kinder gleichaussehend auf die Welt. Es gibt schon ""kompakte"" Babies, aber jedermann weiß doch, dass sich das in Kürze ""verwächst"". Manche haben halt viel Baby""speck"" und andere weniger. Auch sind nicht alle Babies anfangs ""schön"",werden es aber umgehend!"
		TVMovie		Sophie Turner: „Fat-Shaming“ wegen „Game of Thrones“ – So mies verhielten sich die Fans	https://www.tvmovie.de/news/sophie-turner-fat-shaming-wegen-game-of-thrones-so-mies-verhielten-sich-die-fans-105733	Sophie Turner gehört aktuell zu den gefeiertsten Schauspielerinnen überhaupt. Trotzdem plagten sie jahrelang Selbstzweifel. Schuld daran sind „Game of Thrones“-Fans. Die 23-jährige „X-Men“- und „Game of Thrones“-Darstellerin Sophie Turner steht seit ihrem 15. Lebensjahr im Rampenlicht. Die Serien-Adaption von George R. R. Martins Fantasy-Romanen machte die Engländerin weltberühmt und brachte ihr acht Nominierungen für diverse Schauspielpreise ein, drei davon (Empire Hero Award, Glamour Award und EWwy Award) gewann sie sogar. Doch während ihre Serienfigur Sansa Stark sich im Verlauf von „Game of Thrones“ von einem schüchternen, unterdrückten Mädchen zur selbstbewussten, selbstbestimmten Frau wandelte, lässt sich Sophie Turner bis heute schnell unsichern. Das verriet sie in einem Interview mit (TV-)Psychologe Phil McGraw alias „Dr. Phil“, der in den Neunzigerjahren durch die „Ophrah Winfrey Show“ bekannt wurde. Mit ihm sprach Turner nicht nur offen über ihre Depression, sie verriet auch, welchen Part „Game of Thrones“ in Bezug auf ihre Krankheit spielte. „Alles war super. Das änderte sich aber, als ich in die Pubertät kam und sich mein Stoffwechsel verlangsamte und ich an Gewicht zulegte. Dann kamen die prüfenden Blicke aus den sozialen Netzwerken hinzu. Das war der Punkt, an dem es mich erwischte!“, erklärt Turner im Gespräch. Social Media sei zwar nicht der Grund gewesen, dass sie Depressionen bekommen habe (immerhin handle es sich dabei um ein chemisches Ungleichgewicht im Gehirn), die Anfeindungen dort seien jedoch einer der Auslöser gewesen. Die fiesen Kommentare richteten sich dabei laut Turner vor allem gegen ihre Serien-Figur Sansa. „Sansa ist fett geworden“ oder „Sansa sollte dringend wieder zehn Pfund abspecken“ seien zum Beispiel Kommentare gewesen, die Turner gekränkten und verunsicherten. Neben gemeinen Sprüchen über ihr Gewicht habe man sie zusätzlich wegen Hautunreinheiten oder ihrer „hölzernen Art zu Schauspielern“ beleidigt. Am „Game of Thrones“-Set bat sie die Crew daher häufig, ihr Korsett noch enger zu schnüren. Sie sei immer unsicherer geworden, so Turner weiter und habe sich schließlich sogar für ihre Nase geschämt, die sie als zu groß empfand. „Es hat mich kreativ beeinflusst. Ich konnte der Figur nicht mehr gerecht werden, weil ich so mit ‚Sophie‘ beschäftigt war“, erzählt sie Dr. Phil. Die einzige Person, der sie sich anvertraut habe, sei „Game of Thrones“-Co-Star und beste Freundin Maisie Williams gewesen, die im Übrigen ähnliche Probleme gehabt habe. Gemeinsam zogen sich die beiden immer mehr zurück, kauften sich Snacks und aßen diese im Bett. Mit der Zeit habe Turner sich immer mehr isoliert, zu nichts mehr Lust gehabt und sich kaum noch vor die Tür getraut – nicht einmal um Freunde zu treffen. Heute geht es Turner besser. „Ich kann mich jetzt mehr lieben als früher und ich bin mit jemandem zusammen, der mir vor Augen führt, dass ich sehr wohl tolle Eigenschaften habe. Wenn dir jemand jeden Tag sagt, dass er dich liebt, dann hilft das […].“ Die sozialen Medien versucht sie heute zu meiden. Auch jahrelange Therapie und Medikamente haben ihr geholfen, ihre Depressionen in den Griff zu bekommen. „Diese Leute kennen dich nicht. Sie würden dir alle das nie ins Gesicht sagen. Es sind bloß Tastatur-Mobber. Im echten Leben würden sie vermutlich nicht einmal mit dir sprechen, sondern sich in die Hose machen“, bestärkt Dr. Phil den „Game of Thrones“-Star, die Kommentare in Zukunft zu ignorieren oder weniger an sich heranzulassen. Was Sophie Turner sonst noch im Interview verriet, erfahrt ihr hier: Menschen, die im Netz mit Beleidigungen und fiesen Kommentaren um sich werfen, dürfte (oder sollte) Sophie Turners Geschichte eine Lehre sein!
23-9-2020	16:44:03Z	WELT		Straßburg: „Sei still, Schlampe“ – Empörung über Angriff auf Studentin	https://www.welt.de/vermischtes/article216419102/Strassburg-Sei-still-Schlampe-Empoerung-ueber-Angriff-auf-Studentin.html	Ein mutmaßlich sexistisch motivierter Angriff auf eine Studentin sorgt in Frankreich für Empörung. Die 22 Jahre alte Studentin Elisabeth wurde nach eigenen Angaben vergangenen Freitag tagsüber nahe der Straßburger Innenstadt, am Einkaufszentrum Rivétoile, von drei Männern erst beschimpft und dann geschlagen, weil sie einen Rock trug. Auf dem Heimweg hätten die Männer zunächst im Vorbeigehen ein „Guck dir die Nutte im Rock an“ geäußert, woraufhin Elisabeth ihnen ein „Entschuldigung?“ entgegengeschleudert habe. Daraufhin sei die Situation eskaliert. Als Reaktion habe einer der Männer ihr zunächst gesagt: „Halt den Mund, Schlampe, senke den Blick und sei still.“ Dann hätten sie zwei der Männer festgehalten und der dritte ihr ins Gesicht geschlagen, bevor sie flohen, so die Studentin, die bei der Erzählung des Vorfalls bei France Bleu ein blaues Auge hatte. Sie erhob zudem Vorwürfe gegen Zeugen des Angriffs. Rund 15 Menschen hätten diesen gesehen, aber nichts unternommen, auch nicht ausgesagt, sagte die 22-Jährige. „Keine Reaktion, als wäre nichts geschehen.“ In ihrem Video rief sie die Zeugen auf, sich zu melden, um die Täter dingfest zu machen, bevor sie dasselbe auch anderen Frauen antun. „Ich verstehe nicht, wie man am Abend nach Hause gehen kann im Wissen, eine Frau so beleidigt und geschlagen zu haben, und dann auf sich stolz zu sein. So etwas einer Frau anzutun ist nicht männlich. Ihr seid keine Männer!“, so die Studentin weiter. Die Regierung verurteile den Vorfall im elsässischen Straßburg scharf, sagte Sprecher Gabriel Attal am Mittwoch. Jeder müsse in Frankreich in der Lage sein, in der Kleidung auf die Straße gehen zu können, die sie oder er tragen wolle. Frauen dürften sich nicht wegen der Wahl ihrer Klamotten gefährdet fühlen, belästigt, bedroht oder angegriffen werden, betonte Attal. Die Polizei leitete Medienberichten zufolge Ermittlungen zu dem Fall ein. Demnach erstatte die Studentin auch Anzeige. Die beigeordnete Ministerin im Innenministerium und Ex-Staatssekretärin für Gleichstellung, Marlène Schiappa, reiste am Mittwoch nach Straßburg, um sich dort mit Vertretern der Polizei und Präfektur zu treffen, um über einen besseren Schutz für Frauen zu sprechen. „Der Rock ist nicht für den Angriff verantwortlich und die Frau noch weniger“, sagte Schiappa France Bleu. „Vielmehr handeln hier misogyne, sexistische, gewalttätige Menschen, die sich über jedes Gesetz und jede Verhaltensregel hinwegsetzen.“ In Straßburg werde bis 2021 durch das Innenministerium ein Sozialarbeiter oder eine Sozialarbeiterin in der Polizeistation eingestellt, sagte Schiappa einem Bericht der Lokalzeitung „DNA“ zufolge. Damit solle der Dialog zwischen Opfern geschlechtsspezifischer und sexueller Gewalt und der Polizei verbessert werden.
		WOMAN.at	(red.)	"Meghan wird als ""fett"" bezeichnet und sie hat die beste Antwort!"	https://www.woman.at/a/meghan-markle-als-fett-bezeichnet-schwanger	"Meghan Markle wurde kürzlich bei einem Event als ""Fat Lady"" bezeichnet. Wie sie auf diesen Sager reagierte, ist mehr als royal - wir hätten da nämlich anders reagiert... Es passiert auch nicht jeden Tag, dass jemand Meghan Markle, aka die Herzogin von Sussex, als ""fat lady"", also als fette Dame bezeichnet. Aber genau das passierte am 16. Jänner dieses Jahres, als sie eine Tierschutzorganisation besuchte. Dort hat sie vier Patenschaften übernommen. Aber glaubt es oder nicht - der Moment war eigentlich ganz süß. (wirklich.) Als Markle mehrere ältere Frauen begrüßte, die freiwillig für die Organisation tätig sind, passierte es. Die Herzogin tauschte mit jeder Frau Freundlichkeiten aus, als einer der Freiwilligen sagte: ""Schöne Dame, Sie sind es! Möge der gute Herr Sie immer segnen ... Sie sind eine dicke Frau!"" (Während sie auf Markles Babybauch deutete). Markle brach in Lachen aus und antwortete mit einem einfachen ""Das stimmt wohl!"" Ohne einen Takt zu verpassen. Während wir normalerweise niemals unaufgeforderte Kommentare über das Äußere einer Person durchgehen lassen, rutscht dieser Sager dann doch irgendwie durch. Der Witz wurde offensichtlich aus gutmütigem, höflichem Spaß gemacht, und Markle schien den unerwarteten Austausch wirklich zu genießen (wir haben das Gefühl, dass ihre Begegnungen mit anderen Menschen dieser Tage meist eher recht steif sind). Und falls du dich fragen solltest: Meghan Markle trägt hier ein 30 Euro H&M-Kleid in Kombination mit einem Armani-Mantel. Er erinnert uns daran, dass die Kombination von erschwinglichen und hochwertigen Kleidungsstücken nicht nur stylisch ist, sondern auch von den Royals anerkannt ist. HIER kannst du das kuschelige Winterkleid übrigens nachshoppen! Jetzt anmelden und mitdiskutieren!"
		RTL Online	RTL Interactive GmbH	GZSZ-Star Felix von Jascheroff hat genug von fiesen Fat-Shaming-Kommentaren	https://www.rtl.de/cms/gzsz-star-felix-von-jascheroff-hat-genug-von-fiesen-fat-shaming-kommentaren-4275470.html	"11. Januar 2019 - 12:56 Uhr GZSZ-Schauspieler Felix von Jascheroff (36) hat die Nase voll von Fat-Shaming. Auf seinem Instagram-Account setzt er sich gegen all die Hater zur Wehr, die fiese Sachen wie ""Felix, du bist ja voll fett geworden!"" schreiben. Jetzt spricht Felix von Jascheroff öffentlich und bekommt Rückendeckung von seiner GZSZ-Kollegin Valentina Pahde. Nicht nur weibliche Stars müssen in den sozialen Medien oft fieses Body-Shaming ertragen, auch ihre männlichen Kollegen müssen sich gemeine Sprüche über ihre vermeintlichen Fettpolster und Figurprobleme anhören. Diese leidvolle Erfahrung macht auch ""Gute Zeiten, schlechte Zeiten""-Schauspieler Felix von Jascheroff. Bei Instagram muss er Kommentare wie ""voll der Pummel"" über sich ergehen lassen. Das findet Felix fies und geht in die Offensive. ""Egal, ob man ein paar Kilos mehr auf den Rippen trägt oder zu wenig. Solange man sich wohlfühlt, ist das genau richtig!!!"", schreibt er unter anderem bei Instagram. Recht hat er. Und bei seinem Anblick fragt man sich, wie überhaupt jemand schreiben kann, dass Felix ""fett"" sei. Der berühmte Jo-Jo-Effekt begleitet Felix von Jascheroff schon eine ganze Weile durchs Leben. Doch der Schauspieler ist im Reinen mit seinem Körper und hat keine Probleme damit, mal etwas mehr und mal etwas weniger zu wiegen. ""Ich bin kein Kind von Traurigkeit. Ich bin auch eine faule Sau"", witzelt er. Statt ins Fitnessstudio zu gehen, greift der GZSZ-Star auch manchmal gern zur Pizza. Seine gelassene Art kommt an und beeindruckt auch seine GZSZ-Kollegin Valentina Pahde. ""Ich finde es mutig von Felix, dass er sich dazu äußert."""
