Publication Date	Time	Publisher	Author	Title	URL	Text
		ZEIT ONLINE		"Body Positivity: ""Das Ziel ist nicht, seine Pickel schön zu finden"""	https://www.zeit.de/die-antwort/2019-08/body-positivity-schoenheitswahn-body-neutrality-selbstbewusstsein	Um der Nutzung mit Werbung zuzustimmen, muss JavaScript in Ihrem Browser aktiviert sein. Besuchen Sie zeit.de wie gewohnt mit Werbung und Tracking. Details zum Tracking finden Sie in der Datenschutzerklärung und im Privacy Center. Zustimmung jederzeit über den Link Privacy Einstellungen am Ende jeder Seite widerrufbar. Nutzen Sie zeit.de mit weniger Werbung und ohne Werbetracking für 1,20 €/Woche (für Digital-Abonnenten nur 0,40 €/Woche). Bereits PUR-Abonnent? Hier anmelden. Wir erheben personenbezogene Daten und übermitteln diese auch an Drittanbieter, die uns helfen, unser Webangebot zu verbessern und zu finanzieren. Eine Verarbeitung der auf Ihrem Gerät gespeicherten Informationen wie z.B. Cookies oder persönliche Identifikatoren, IP-Adressen sowie Ihres individuellen Nutzungsverhaltens erfolgt dabei zu den folgenden Zwecken: Für die Ihnen angezeigten Verarbeitungszwecke können Cookies, Geräte-Kennungen oder andere Informationen auf Ihrem Gerät gespeichert oder abgerufen werden. Anzeigen und Inhalte können basierend auf einem Profil personalisiert werden. Es können mehr Daten hinzugefügt werden, um Anzeigen und Inhalte besser zu personalisieren. Die Performance von Anzeigen und Inhalten kann gemessen werden. Erkenntnisse über Zielgruppen, die die Anzeigen und Inhalte betrachtet haben, können abgeleitet werden. Daten können verwendet werden, um Benutzerfreundlichkeit, Systeme und Software aufzubauen oder zu verbessern.
13-12-2019	08:00:00Z	Süddeutsche Zeitung	Kathrin Werner	Nicht perfekt ist perfekt	https://www.sueddeutsche.de/wirtschaft/schoenheit-nicht-perfekt-ist-perfekt-1.4722304	"Die Werbung rückt immer öfter vom klassischen Schönheitsideal ab. Dick und dünn kann gleichermaßen schön sein. Fotos von Speckröllchen: Body Positivity ist ein Trend, der in sozialen Medien begonnen hat. Inzwischen entdecken ihn Firmen. Von .css-viqvuv{border-bottom:1px solid #29293a;-webkit-text-decoration:none;text-decoration:none;-webkit-transition:border-bottom 150ms ease-in-out;transition:border-bottom 150ms ease-in-out;}.css-viqvuv:hover{border-bottom-color:transparent;}Kathrin Werner Spätestens wenn Sat 1 eine Serie zu einem Thema macht, kann man sagen: Es ist in der Mitte der Gesellschaft angekommen. In der Reality-Show ""No Body is perfect"" gibt es von Januar an nackte Menschen auf einer Insel zu sehen. Sie sind Coaches, die ihre eigenen unperfekten Körper vorzeigen, damit die Show-Kandidaten lernen, dass es in Ordnung ist, selbst nicht perfekt auszusehen - und am Ende selbst die Hüllen fallen lassen. Es sei ein ""Body-Positivity-Experiment"", teilte Sat 1 mit. Body Positivity ist ein Trend, der in sozialen Medien begonnen hat. Influencerinnen und Influencer veröffentlichen Fotos von ihren Speckröllchen, Körperhaaren oder Falten - Bilder ohne Nachbearbeitung und vorteilhafte Ausschnitte und oft auch ohne Make-up. Damit wollen sie erreichen, dass auch Menschen als schön gelten, die eigentlich nicht den Schönheitsidealen entsprechen. Schönheitsideale sollen sich erweitern. Das Übergrößen-Model Iskra Lawrence zum Beispiel postete im Sommer ein Bild von sich im pinken Badeanzug - samt Cellulitis. ""Das Leben ist so viel einfacher, wenn man es für sich selbst lebt"", schrieb sie dazu. ""Nicht für das Schönheitsideal eines anderen, die Bestätigung eines anderen oder eine sozial konstruierte Perfektion."" Kein Zufall: Unter dem Foto markierte sie den Hersteller des Badeanzugs, Aerie, für den sie arbeitet. Body Positivity ist inzwischen nicht nur ein Social-Media-Thema, sondern ein großes Geschäft. Aerie, Sat 1 und eine immer länger werdende Liste anderer Unternehmen wollen Geld damit verdienen, dass Frauen - und seltener auch Männer - sich in ihren Körpern wohlfühlen. Sie setzen statt auf die lange üblichen Magermodels plötzlich auf solche, die irgendeinen Makel haben - was traditionell als Makel gilt. Die US-Einzelhandelskette Target bewarb Badeanzüge mit einem Model, das Dehnstreifen am Bauch hatte. Das Model Winnie Harlow, das wegen einer Krankheit große weiße Flecken auf ihrer dunklen Haut hat, ist seit Jahren sehr erfolgreich, unter anderem als Markenbotschafterin der spanischen Modemarke Desigual. Adidas hat das Model Arvida Byström in den Turnschuhen der Firma fotografiert, mit langen Haaren an den Beinen. Menschen haben ihr mit Vergewaltigung gedroht deshalb. Angefangen mit Body-Positivity-Marketing hat die Körperpflegemarke Dove - und zwar schon 2004. ""Wir sehen uns bei Dove als einen der Pioniere in Sachen Body Positivity"", sagt Hilke Krause, die beim Mutterkonzern Unilever für alle Haar-, Körper- und Zahnpflegemarken in Deutschland zuständig ist. ""Für Unilever war das damals etwas völlig Neues. Es war auch intern eine Sensation, dass die Entscheidungsträger das mitgemacht haben."" Dove wirbt mit ""echten Frauen"" statt mit Profi-Models und will die Vielfalt in der Gesellschaft abbilden, zum Beispiel was Hautfarben und Körperformen angeht. Die Firma manipuliert die Fotos nicht und engagiert sich in Bildungsprojekten, sie will Mädchen Selbstbewusstsein vermitteln. ""Werbung hat Macht"", sagt Krause. ""Ich ertappe mich ja manchmal selber. Wenn ich ein Model mit einem Sixpack sehe, schaue ich an mir runter und denke: Das hätte ich auch gern. Dabei weiß ich eigentlich, dass ein Sixpack fast gar nicht zu schaffen ist."" Besonders junge Mädchen seien anfällig für falsche Ideale. ""Es geht auch darum, mehr Vielfalt an Vorbildern für junge Frauen zu zeigen."" In einer der jüngsten Werbekampagne hat Dove Models ausgesucht, ohne vorher ein Bild von ihnen gesehen zu haben. Auswahlkriterium waren stattdessen Briefe, in denen die Frauen sich selbst und ihre Lebenswege beschrieben. Die Werbung habe sich auch finanziell gelohnt, sagt Krause. ""Der Umsatz hat sich danach messbar gesteigert. Das bestärkt uns natürlich darin, weiterzumachen."" Laut einer Studie der amerikanischen Northeastern University kommt Werbung mit Models mit verschiedenen Hautfarben, Körpertypen und sonstigen Merkmalen insgesamt gut an bei Kundinnen. Die meisten Frauen, denen die Forscher in einer Umfrage Bilder von Aerie-Unterwäschemodels zeigten, gaben an, sich danach mit ihren Körpern wohler zu fühlen. Auch die Marke werde positiver wahrgenommen, sie seien nun eher bereit, sie zu kaufen. Allerdings kritisierten auch einige der Befragten, dass selbst die leicht übergewichtigen Aerie-Models durchweg noch sehr attraktiv nach klassischen Schönheitsidealen waren. Sie stellten infrage, ob die Firma es tatsächlich ernst meine, schließlich gehe es ihr letztlich ja doch um Profit. Aeries Umsatz stieg im Jahr nach der Kampagne um 20 Prozent. Entsprechend wächst die Zahl der Unternehmen, die bei dem Trend mitmachen. Die niederländische Unterhosenfirma Pockies wollte nicht mehr mit den immer gleichen durchtrainierten Männermodels werben, sondern suchte sich Laienmodels auf Berliner Straßen. H&M drehte vor ein paar Jahren ein Werbevideo mit Models mit Achselhaaren, einer Transfrau und diversen anderen Frauen, die sich nicht darum kümmerten, ladylike zu wirken. Die Drogeriekette Rossmann hat sogar einen Artikel auf ihrer Internetseite, in dem sie die Body-Positivity-Bewegung erklärt. ""Du bist gut, so wie du bist!"", schreibt Rossmann. Die Schlussfolgerung, dass man dann diverse Produkte aus dem Sortiment nicht mehr kaufen müsste, erwähnt Rossmann nicht. Es ist ein Dilemma, das manche Unternehmen weiterhin davon abhält, auf klassisch hübsche Werbefiguren zu verzichten. ""Unsere direkten Konkurrenten machen das noch nicht"", sagt Krause von Dove. Sie würde es begrüßen, wenn mehr Firmen mitmachen, ""weil es ja um gesellschaftlichen Wandel geht und man den nur gemeinsam schaffen kann"", sagt sie. ""Oft fehlt doch noch der Mut."" Gerade bei Kosmetikfirmen gebe es Nachholbedarf, die noch immer oft Faltencremes mit faltenfreien Gesichtern bewürben. Für Dove stelle sich das Dilemma nicht im gleichen Ausmaß. ""Egal wie man aussieht, ist Pflege eine gute Idee."" Die Body-Positivity-Bewegung hat sich in letzter Zeit weiterentwickelt. Aktivistinnen fühlen sich nicht wohl damit, dass der Kapitalismus die Idee gekapert hat. Außerdem kritisieren sie, dass sich zwar leicht erweitert hat, welche Frauen man in der Werbung zu sehen bekommt, aber eben nur leicht. Heidi Klums Fernseh-Castingshow ""Germany's Next Topmodel"" zum Beispiel feierte sich selbst, weil es 2018 auch ein ""Curvy Model"" ins Finale geschafft hatte. Es trug allerdings Konfektionsgröße 36/38, hatte also eine ganz normale Figur. Stark übergewichtige Frauen kommen in der Werbung kaum vor. Der Nachfolge-Trend zu Body Positivity heißt Body Neutrality - und dürfte bei Marketingmanagern wenig Anklang finden. Er vertritt, dass Frauen ihren Körper nicht mehr so wichtig nehmen und sich über andere Dinge definieren sollten."
28-5-2020	07:00:00Z	derStandard.de		Body-Positivity: Ein Blick auf die Kunst statt auf die Waage	https://apps.derstandard.de/privacywall/story/2000117739993/body-positivity-ein-blick-auf-die-kunst-statt-auf-die	Große und kleine Stars hängen der Bewegung an. Doch warum sollte sich das Publikum für den Umgang mit ihrem Gewicht interessieren? Popmusik gilt als Zerstreuungskunst, als leichte Kost und hedonistische Übung eines unbeschwerten Lebens. Ihrem Wesen nach ist sie gefallsüchtig, will von vielen gehört werden, populär sein. Das gilt vornehmlich für die Chartsmusik als Versorger der Masse, für die Musik ein Alltagsaccessoire ist. Zur Oberflächlichkeit gehört die Imagepflege der Darsteller. Die trainierten Bauchmuskeln der Boygroups, die harten Trizeps der toughen Frauen. Wenn jemand auftaucht, der oder die diese Schablonen sprengt, und das passiert immer wieder, wird das erstaunt thematisiert. So als wäre ein Alien in der Hitparade gelandet. Aktuell ist Alma so ein Alien.
4-1-2020	08:00:00Z	Handelsblatt	Tillmann Prüfer	Prüfers Kolumne: Perfekt unperfekt: Warum der neue Trend Body-Positivity sehr gut ist	https://www.handelsblatt.com/meinung/kommentare/pruefers-kolumne-perfekt-unperfekt-warum-der-neue-trend-body-positivity-sehr-gut-ist/25380366.html?ticket=ST-15277466-LJZVOklaJyrXu617JWNw-ap6	Tillmann Prüfer ist Mitglied der Chefredaktion des „Zeit-Magazins“. Ich beginne das neue Jahr mit ganz viel Body-Positivity. Das ist ein neuer Trend, und er kommt mir gerade recht. Bei Body-Positivity geht es darum, den eigenen Körper schön zu finden, wie er ist, mit all seinen Makeln. Obgleich man ja nicht einmal von „Makeln“ sprechen sollte. Ein Körper, der nicht den gesellschaftlichen Maßstäben entspricht, ist nämlich nicht makelbehaftet, sondern einfach anders schön. Auf Sat 1 gibt es ab Januar eine neue Realityshow: „No Body is perfect“. Menschen nackt auf einer Insel. Sie sind Coaches, die den Showkandidaten ihre eigenen unperfekten Körper vorzeigen, um ihnen beizubringen, dass es in Ordnung ist, selbst nicht perfekt auszusehen. Am Ende der Show sollen dann alle die Hüllen fallen lassen. Laut Sat 1 ist das ein „Body-Positivity-Experiment“. Der Sender beruft sich dabei auf eine Studie des Wissenschaftlers Keon West von der Goldsmith University in London, wonach es das Selbstwertgefühl eines Menschen steigere, wenn er sich durchschnittliche Körper anschaue und sich selbst mehr mit seinem nackten Körper beschäftige. Ich finde es gut, dass sich das Privatfernsehen in Deutschland für die Wissenschaft engagiert und nun herausfinden möchte, ob sich dieses Wohlgefühl auch dann noch einstellt, wenn man beim Entkleiden von einem Drehteam beobachtet wird. In der „Süddeutschen Zeitung“ habe ich gelesen, dass der Trend der Körperpositivität in den sozialen Medien losgegangen ist. Influencer und Influencerinnen zeigen ihre Speckröllchen in die Kamera. Models zeigen ihre Cellulitis und erklären, dass es viel wichtiger ist, sich selbst schön zu finden, als sich an gesellschaftlichen Maßstäben messen zu lassen. Die Zeitung zitierte eine Studie der amerikanischen Northeastern University, die ergeben habe, dass Werbung mit Models mit verschiedenen Hautfarben, Körpertypen und sonstigen Merkmalen insgesamt gut ankomme bei Kundinnen. Forscher hatten Frauen Fotos von Unterwäschemodels mit Körpern gezeigt, die nicht dem gängigen Schönheits- ideal entsprachen. Die Frauen gaben danach an, sich in ihren Körpern wohler zu fühlen. Deswegen setze die Werbewirtschaft nun zunehmend auf unperfekte Models. Wenn das Betrachten durchschnittlicher Nacktheit wirklich glücklich macht, müssten die Deutschen schon jetzt eines der zufriedensten Völker sein. Schließlich haben die Deutschen FKK erfunden, und 30 Millionen Deutsche gehen sich laut Saunaverband regelmäßig saunen. Ich selbst habe mich sehr mit meinem Körper angefreundet, ich stehe ihm absolut positiv gegenüber, vor allem, weil er ja leider alternativlos ist. Es gehört vielleicht zum Erwachsenwerden dazu, sich mit den Dingen anzufreunden, die man ohnehin nicht ändern kann. Richtig verstanden habe ich das, als ich zuletzt regelmäßig ein Fitnessstudio besuchte. Nach einer ganzen Weile sagte mir mein Trainer, ich sei eben ein „Hard Gainer“: Um mehr Muskeln anzusetzen, müsste ich viel mehr essen, Proteinshakes trinken und viel mehr trainieren als andere. Da erscheint mir Body-Positivity als die bessere Alternative. Hauptsache, niemand zeigt in einem Experiment anderen Leuten Unterwäschefotos von mir und fragt sie danach, ob sie sich besser fühlen. Mehr: Nicht für jeden ist Sport im Fitnessstudio das Richtige. Zum Glück hat sich mittlerweile hat ein großer Markt mit digitalen Sportangeboten etabliert.
22-8-2020	07:00:00Z	FOCUS Online	FOCUS Online	Bodypositivity auf Instagram: Ich will meine Makel nicht schön finden müssen	https://www.focus.de/kultur/social-media-nutzung-cellulite-im-feed-beauty-filter-in-der-story-warum-ich-instagram-gerade-so-widerspruechlich-finde_id_12344875.html	Statt auf meiner Lieblingsplattform „Instagram“ wie bisher gewohnt perfekt inszenierte Bilder vorzufinden, stoße ich vermehrt auf Dehnungsstreifen und Pickel. Die Message dahinter: Liebe dich, so wie du bist. Gleichzeitig boomen in den Story-Clips sogenannte „Beauty-Filter“ – wie passt das zusammen? Ein Kommentar. Ex-Germanys-next-Topmodel-Teilnehmerin und Zweitplatzierte Elena Carriere ist das jüngste Beispiel: Auf Instagram teilte die Influencerin zwei Spiegel-Selfies, versehen mit den Hashtags „selflove“ (Selbstliebe) und „realvsfake“ (Wahrheit statt Unwahrheit). Auf den ersten Blick wirken die aneinandergereihten Bilder ziemlich ähnlich. Beide zeigen Model Carriere auf dem Boden sitzend in einem knappen Kleid. Erst bei genauerem Hinsehen stelle ich fest: Während sie auf dem Foto links lasziv mit Schmollmund in die Kamera blickt und die Beine gekonnt in Szene setzt, versucht sie auf dem rechten Foto, gewollt „unattraktiv“ zu wirken. Sofern ein Model das eben kann. Mühe gibt sich die 23-Jährige jedenfalls. Übertrieben beißt sie sich auf dem rechten Bild auf ihre Unterlippe, was den Eindruck von Hasenzähnen erwecken soll. Das graue Hängerkleidchen hat sie nun bis unter die Brust geschoben. Statt kerzengerade dazusitzen, geht sie ins Hohlkreuz, was eine vermeintliche „Speckrolle“ hervorbringen soll. Darunter ermutigt sie ihre fast 500.000 Follower, ihrem Beispiel zu folgen: „Je realistischer, offener und authentischer du dich zeigst, desto mehr Menschen werden dich für das lieben, was du wirklich bist“. Mit dieser Aussage mag Carriere zwar völlig richtig liegen, aber: Ist es nicht genauso „fake“, Hasenzähne und Fettröllchen durch eine bestimmte Haltung zu inszenieren? Schließlich bewege ich mich im „real life“ auch nicht permanent mit einem Katzenbuckel durch die Gegend, sodass sich mein Bauch wölbt. Die vermehrte Aufforderung, sich selbst zu lieben, kommt mir immer öfter auch auf privaten Social-Media-Profilen unter. Meine alte Schulfreundin Anna* etwa erklärt in ihren letzten Postings, jeder Körper sei „einzigartig und wunderschön“ - selbst wenn er nicht dem von der Gesellschaft konstruierten Schönheitsideal enstpreche. „Body-Positivity“ nennt sich, wozu Model Elena und Freundin Anna* im Netz aufrufen. Die Bewegung richtet sich vor allem an Frauen in sozialen Netzwerken und will diese ermutigen, den eigenen Körper vorbehaltlos zu lieben. Dehnungsstreifen etwa werden von Anhängern in „Tiger Stripes“ umbenannt und online regelrecht zelebriert statt kaschiert. In den aktuellen Instagram-Beiträgen wimmelt es also nur so vor „Selbstliebe“. Umso erstaunlicher empfinde ich es, dass bei den Instagram-Stories davon wenig zu spüren ist. Klicke ich mich durch die kurzen Clips, die 24 Stunden nach Aufnahme von selbst verschwinden, fällt auf: Viele Social-Media-Nutzer trauen sich nur mit einem „Filter“ vor die Frontkamera. Instagram selbst bezeichnet diese „Filter“, die sich der User per Gesichtserkennung über das eigene Gesicht legen kann, als „Effekt“. In der eigens angelegten „Effektgalerie“ stoße ich auf tausende Angebote, das eigene Gesicht für den Social Media Auftritt etwas „zu tunen.“ So divers die Auswahl ist, desto ähnlicher der Effekt. In der Frontkamera erblicke ich mich selbst mit absurd schmalem Näschen, ebenso absurd weichgezeichneter Haut und bis zur Stirn ragenden Wangenknochen. Erschreckt stelle ich dabei fest: Während die veränderten Gesichtszüge anfangs noch zombieartig wirken, finde ich mit der Zeit Gefallen an meinen voluminöseren Lippen und den niedlichen Sommersprossen auf der Nase. Drücke ich auf das „graue X“ und blicke nun wieder meinem eigenen, ganz unbearbeitetem Gesicht entgegen, bin ich von so viel „Realität“ fast enttäuscht. Egal ob Beauty-Filter in der Insta-Story oder Cellulite im Feed: Ich finde die Fixierung auf physische Merkmale anstrengend. Bevor ich nicht täglich mit Dehnungsstreifen in den sozialen Netzwerken konfrontiert wurde, habe ich mir über mein Bindegewebe überhaupt keine Gedanken gemacht. Die andauernde Aufforderung, vermeintliche Makel schön finden zu müssen, ist mit genauso viel Druck belastet, wie einen makellosen Körper aufweisen zu müssen. Wäre es nicht viel entspannter, unserem Aussehen erst gar nicht so einen hohen Stellenwert zuzuschreiben? Dieser Wunschgedanke hat längst einen Namen: „Body-Neutrality“. Ich bin gespannt, wann Elena und Anna* ihn als Hashtag für sich entdecken. Vielen Dank! Ihr Kommentar wurde abgeschickt. Im Interesse unserer User behalten wir uns vor, jeden Beitrag vor der Veröffentlichung zu prüfen. Als registrierter Nutzer werden Sie automatisch per E-Mail benachrichtigt, wenn Ihr Kommentar freigeschaltet wurde.
		desired.de	Nina Röller	Body Positivity: Es muss auch Toleranz für Frauen auf Diät geben	https://www.desired.de/lifestyle/fuer-body-positivity-aber-selbst-auf-diaet-geht-das/	
		Wienerin		Wir brauchen viel mehr als den Body-Positivity-Trend	https://wienerin.at/wir-brauchen-viel-mehr-als-den-body-positivity-trend	
		jolie.de		Wie gesund ist die Body Positivity-Bewegung?	https://www.jolie.de/leben/body-positivity-kritik	"Unter dem Hashtag Body Positivity finden sich bei Instagram knapp zwei Millionen Einträge. Hierunter finden sich Bilder von Frauen, die ihre Körper lieben oder dabei sind, genau das zu lernen. Wie wichtig das ist, wird einem wohl erst bewusst, wenn man selbst Probleme damit hat. Selbstliebe ist essentiell für ein glückliches Leben. Ob nun mehr oder weniger Kurven – so unterschiedlich Frauenkörper sind, so schön ist jeder einzelne. Wenn die Body Positivity-Bewegung ein bisschen dazu beitragen kann, ist das natürlich Gold wert. Was man aber trotzdem nicht außer acht lassen darf: Enormes Übergewicht ist per se ungesund. Und sollte nicht verherrlicht oder schön geredet werden. Ein paar Gedanken dazu. Man begibt sich auf dünnes Eis, wenn man als normalgewichtige Person die Body Positivity-Bewegung hinterfragt, sich gar kritisch dazu äußert. Klar, schließlich ist man selbst nicht betroffen – zumindest nicht in diese Richtung. Wir möchten deshalb vorab klarstellen, dass dies keineswegs ein Pro-Bodyshaming-Artikel ist. Keinesfalls. Es geht uns hier vor allem nicht um das ästhetische Empfinden, denn aussehen darf – nein soll – jeder, wie er mag. Und auch wohlfühlen soll sich jeder in seinem Körper, insofern ist die Body Positivity-Bewegung absolut zu unterstützen. Aber was man dabei nicht vergessen sollte: einen gesunden Lebenswandel. Und der ist ab 120 Kilo aufwärts einfach nicht mehr gegeben. Das ist Fakt. Ob Ashley Graham, Iskra Lawrence, Emily Bador, Tess Holliday, Megan Jayne Crabbe oder Angelina Kirsch – alle stehen exemplarisch für die Body Positivity-Bewegung, die via Social Media in den letzten Monaten und Jahren weite Kreise gezogen hat. Sie alle feiern ihre Kurven, setzen sich dafür ein, dass Frauen jeden Typs und Gewichts lernen, sich und ihren Körper zu lieben. Von jenen sprechen wir hier nicht. Der Grundgedanke hinter der Body Positivity-Bewegung ist richtig und wichtig. Schließlich ist jeder Mensch per se schön – ob er nun mit einer 34 daherkommt oder eben mit einer 44. Bei einer 54 hingegen wird es kritisch. Denn das ist nicht gesund. Wenn wir also bei Magermodels, die (noch immer) über die internationalen Runways der größten Designer laufen, aufschreien, dürfen – nein sollten – wir das nicht auch bei stark übergewichtigen Damen, die Body Positivity predigen? Fakt ist, dass jede vierte Frau in Deutschland adipös ist, also an Fettleibigkeit leidet. Das ist bei einem BMI ab 30 der Fall. Das ist nicht gesund – im Gegenteil. Fettleibigkeit kann langfristig zu chronischen Krankheiten wie Diabetes, Herzproblemen, Bluthochdruck, hohen Cholesterin- und Leberwerten, Kopf-, Gelenk- und Gliederschmerzen, Depressionen und Angstzuständen führen. Die Techniker Krankenkasse veröffentlichte 2016 eine Studie, laut der ein Viertel aller deutschen Frauen an ernährungsbedingten Herz-Kreislauf-Störungen leidet. Tendenz steigend. Das ist alarmierend und höchst bedenklich. Hier ist Body Positivity schlichtweg fehl am Platz. Und auch mit #EffYourBeautyStandards, dem Hashtag, das Plus Size-Model Tess Holliday als Reaktion auf kritische Kommentare hinsichtlich ihres fülligen Körpers ins Leben gerufen hat, ist jenes gesundheitsgefährdende Übergewicht nicht schön zu reden. Denn um ""Beauty Standards"", also um Schönheitsideale, geht es ab 150 Kilo aufwärts schlichtweg nicht mehr. Ist es also nicht fragwürdig, die Bewegung zu feiern, ohne zumindest auf die zunehmende Fettleibigkeit unserer Gesellschaft hinzuweisen? Unsere Organe und Gelenke sind nicht dazu ausgelegt, Übergewicht mit sich rumzutragen. Ob Lunge, Hüften, Herz, Füße oder Knie – Übergewicht wiegt im wahrsten Sinne des Wortes schwer. Auf lange Sicht gesehen erhöht es das Risiko, einen Schlaganfall zu erleiden. ""Fett setzt sich überall an, vor allem an Kopf und Hals, speziell am Nacken. Zu viel Fett drückt auf die Nerven, kann Kopf- und Nackenschmerzen verursachen"", erklärt Mike Hayton, Orthopäde in Manchester. Organe und Knochen leiden unter zu vielen Kilos, sie verkürzen bewiesenermaßen die Lebensdauer. Das ist Tatsache und sicherlich kein Wettern gegen Übergewichtige. Natürlich ist die Gesundheit anderer nicht unser Business und wir feiern jede Frau, die lernt, sich in ihrem Körper wohl zu fühlen, aber so schön man sich auch fühlt, die Gesundheit sollte doch immer vorgehen, oder? I Feel Pretty mit Amy Schumer: Body-Positive oder genau das Gegenteil?"
