Publication Date	Time	Publisher	Author	Title	URL	Text
28-8-2020	07:00:00Z	Apotheken Umschau		Wenn die Figur nicht der Norm entspricht	https://www.apotheken-umschau.de/Soziales/Wenn-die-Figur-nicht-der-Norm-entspricht-560231.html	" Wer anders aussieht, muss mit Häme rechnen. Bodyshaming ist kein neues Phänomen, aber ein ernst zu nehmendes. Von engen Maßstäben und einer positiven Gegenbewegung Nicht perfekt, aber bunt: Das Erscheinungsbild von Menschen kann sehr vielfältig sein. Eigentich macht das den Reiz des Miteinanders aus Dicke haben schrecklich dicke Beine, Dicke ham'n Doppelkinn, Dicke schwitzen wie die Schweine, Stopfen, fressen in sich rin"", sang Marius Müller-Western- hagen 1978. Indem er Beleidigungen, Vorurteile und Klischees aneinander- kettete, wollte er angeblich auf Diskriminierung aufmerksam machen und der Gesellschaft einen Spiegel vorhalten. Genützt hat es wenig. Eine negative Haltung gegenüber Dicken ist auch 40 Jahre später noch Main stream. Laut der repräsentativen Forsa-Umfrage ""XXL-Report"" im Auftrag der DAK finden 71 Prozent der Deutschen stark Übergewichtige unästhetisch, 15 Prozent meiden bewusst den Kontakt. Und wie ein Experiment der Universität Tübingen zeigte, haben selbst psychologisch geschulte Personaler Vorurteile gegenüber adipösen Bewerbern. Wird jemand wegen seines Aussehens diskriminiert oder verbal angegriffen, spricht man von Bodyshaming (""Körperbeschämung""). ""Der Begriff ist neu, Mobbing aufgrund von Äußerlichkeiten gab es aber schon immer"", sagt Professorin Martina de Zwaan, Direktorin der Klinik für Psycho­ somatik und Psychotherapie an der Medizinischen Hochschule Hannover. Menschheitsgeschichtlich sicherte die Angst vor dem Fremden das Überleben. In unserer modernen Welt hat sie keinen entscheidenden Nutzen mehr, dennoch fühlen wir uns unter vertraut wirkenden Menschen wohler: Eine Studie der Wilfrid Laurier University im Journal of Personality and Social Psychology zeigte, dass Personen im öffentlichen Raum unbewusst die Nähe ähnlicher Menschen suchen. Schlankheit und Beliebtheit hängen zusammen, glauben knapp 80 Prozent der Jugendlichen (Bravo Dr.-Sommer-Studie 2016) 70 Prozent der Frauen und 40 Prozent der Männer fühlen sich durch TV-Sendungen und Magazine unter Druck gesetzt, einen perfekten Körperzu haben (Centre for Appearance Research) Allerdings es ist ein großer Unterschied, ob man jemanden aufgrund seines Erscheinungsbildes unbewusst meidet oder aktiv mobbt. Doch was lässt Menschen zu ""Bodyshamern"" werden? ""Zu dieser Art von aggres­sivem Verhalten kann es kommen, wenn die Kompetenz im Umgang mit Neuem fehlt"", erklärt Katharina Koller vom Institut für Jugendkulturforschung in Wien. ""Und wenn gleichzeitig persönlichkeitspsychologisch eine gewisse Unflexibilität gegeben ist."" Kulturelle Werte und Charaktereigenschaften wie Risikobereitschaft oder ein geringes Selbstwertgefühl spielen ebenfalls eine Rolle. Vor allem aber gilt: Je anonymer die Situation und je geringer die erwartbaren Konsequenzen, desto wahrscheinlicher sind aggressive Äußerungen. Während verbale Attacken auf Menschen mit Migrationshintergrund oder Behinderungen mittlerweile gesellschaftlich verpönt sind, wird das sogenannte Fatshaming, also das Mobben von Übergewichtigen, weiterhin akzeptiert. ""Dass schwere Adipositas eine Erkrankung ist und vielfältige Ursachen hat, wird ignoriert"", sagt de Zwaan. ""Egal, ob jemand sich selbst oder andere aufgrund des Körpergewichts diskriminiert: Die landläufige Meinung ist, Dicke seien selbst schuld an ihrem Aussehen."" Die Ergebnisse des ""XXL-Reports"" bestätigen: Die Mehrheit der Deutschen findet, Über- gewichtige seien schlicht ""zu faul"" und ""zu undiszipliniert"" zum Abnehmen. ""Leistung, Selbstkontrolle und Fitness gelten in unserer Gesellschaft als wichtigste Werte – das spiegelt sich in den Schönheitsidealen wider"", erklärt Katharina Koller, Co-Autorin der Studie Bodyshaming und Social Media. Während es in Entwicklungsländern ein Zeichen für Wohlstand ist, etwas fülliger zu sein, gilt bei uns erst derjenige als vollwertiger Teil der Gesellschaft, der dem Überangebot an Nahrung erfolgreich widersteht. Als besonders empfänglich für Schönheitsideale gelten Teenager. Da sie die sozialen Medien vor allem zur Selbstdarstellung nutzen, werden Facebook, Instagram und Youtube zu einem entscheidenden Multiplikator bestehender Schönheitsideale. Ob wir etwas ästhetisch ansprechend finden oder nicht, wird nämlich vor allem durch Erfahrungen bestimmt, wie auch eine Zwillingsstudie der Harvard Medical School im Magazin Current Biology belegte: Wer ständig dünne, durchtrainierte Menschen mit makelloser Haut sieht, wird entsprechend in seiner Selbst- und Fremdwahrnehmung beeinflusst. Verstärkend kommt hinzu, dass die jungen Social-Media-Nutzer es gewohnt sind, permanent bewertet zu werden, wie die Studie Bodyshaming und Social Media zeigt: Wer ein Bikini- oder Ungeschminkt­Selfie postet – weil es für solche Bilder in der Regel besonders viel Beifall gibt –, nimmt abwertende Kommentare bewusst in Kauf. Folgenlos bleibt das Mobbing trotzdem nicht: 39 Prozent der befragten 15- bis 19-jährigen Mädchen fühlten sich durch negatives Feedback gekränkt, 22 Prozent waren danach mit ihrem Aussehen unzufriedener als zuvor, und 11 Prozent änderten sogar ihr Essverhalten. Sogenannte ""Body Positivity Activists"" – meist Menschen, die selbst auf unterschiedliche Weise von den gängigen Schönheitsidealen abweichen – haben dieser Entwicklung den Kampf angesagt und posten unter Hashtags wie #bodypositive Selfies und Erfahrungen mit Bodyshaming. Prominente wie das Model Winnie Harlow, das unter der Weißfleckenkrankheit Vitiligo leidet, oder die adipöse Gossip-Sängerin Beth Ditto sind in vorderster Reihe dabei. ""In meiner Kindheit hätte ich mir gewünscht, auch mal einen Körper wie meinen in den Medien zu sehen"", sagte Ditto in einem Interview mit dem Online-Magazin vip.de. ""Die Body-positivity-Bewegung ermöglicht be- sonders jungen Frauen ein erweitertes Identifikationsmodell und setzt kranken Mager-Trends etwas entgegen"", lobt Katharina Koller. Allerdings werde hier eine andere Art von Druck erzeugt: ""Sich nicht darum kümmern zu dürfen, was andere von einem denken, kann sehr schwierig sein."" Dass unter dem Stichwort ""body-positive"" auch Fotos von sehr hübschen Menschen kursieren, die sich ungeschminkt oder mit kaum sichtbaren ""Makeln"" präsentieren, führt die Ursprungsidee ebenfalls ein Stück weit ad absurdum. Zwar liegt es in der Natur des Menschen, Unbekannte über ihr Aussehen in eine bestimmte Schublade einzusortieren – Stereotype entlasten das Gehirn und ermöglichen eine effiziente Informationsverarbeitung. Aber ist es trotzdem möglich, die innere Stimme abzuschalten, wenn sie allem Wissen zum Trotz mal wieder Bodyshaming betreibt? ""Dass Sie hinschauen und sich Ihren Teil denken, wenn beispielsweise ein sehr dicker Mensch vor Ihnen steht, können Sie nicht verhindern – aber Sie können Ihre Vorurteile hinterfragen"", so Koller. Das erfordert einen kritischen Umgang mit sich selbst und dass man seine Stereo- type-Komfortzone verlässt. Marius Müller-Westernhagen spielt seinen Song ""Dicke"" heute übrigens nicht mehr auf Konzerten und würde ihn auch so nicht mehr veröffentlichen, erklärte er in einem Interview mit der Hannoverschen Allgemeinen: ""Ausgerechnet die Leute, denen ich den Spiegel vorhalten wollte, haben es nicht kapiert."" Vorurteile, missbilligende Blicke und mangelnde Akzeptanz - wie ist damit umzugehen? Unbedingt offen thematisieren, lautet der Tipp"
9-12-2019	08:00:00Z	OnlineMarketing.de		Oh du Sexistische: Weihnachtsspot für Heimtrainer wird zum Gespött auf Twitter	https://onlinemarketing.de/social-media-marketing/oh-du-sexistische-weihnachtsspot-heimtrainer-wird-gespott-twitter	 Ein Gerät zur Gewichtsabnahme ist nicht das sensibelste Weihnachtsgeschenk, das ein Ehemann machen kann. Erneut zeigt sich der starke Einfluss von Social Media Shitstorms. Weihnachtswerbung gehört genauso zur festlichen Jahreszeit wie Lebkuchen, Lichterketten und Co. Einige Unternehmen haben in diesem Segment genau das richtige Gespür und schaffen es, uns mir ihren Spots emotional zu berühren. Andere sollten jedoch lieber die Finger davon lassen. Bestes Beispiel dafür ist der US-amerikanische Fitnessgerätehersteller Peloton. Sein Weihnachtsspot löste einen Shitstorm auf Twitter aus – und bot herrliches Meme-Material. Im Mittelpunkt dieses Werbefauxpas steht ein 30-sekündiger Clip von Peloton. Ein Ehemann schenkt seiner Frau zu Weihnachten einen Heimtrainer in Form eines Fahrrads. Seiner äußerst schlanken, attraktiven Frau. Diese startet sogleich mit dem täglichen Training und hält ihre Fortschritte in Selfie-Videos fest. Ihr Blick dabei wirkt so, als würde hinter der Kamera jemand mit gezückter Pistole stehen. Ein Jahr später, an Weihnachten, schaut sie sich gemeinsam mit ihrem Mann einen Zusammenschnitt der Videos an und feiert, wie sehr das Training sie verändert hat. Bevor wir weiter ins Detail gehen, hier der Clip für alle Neugierigen: Diese Frage sollten die Beschreibung und der Werbespot selbst bereits beantworten: So ziemlich alles. Der Clip reiht sich ein in eine Liste von Werbungen (vor allem an Frauen gerichtete), die nichts mit dem realen Leben zu tun haben. Rasierer, die bereits glatte Beine rasieren, menstruierende Frauen, die freudig auf ihrem Bett herumspringen, und nun ein Heimtrainer, der die Erfolge einer bereits schlanken Kundin anpreist. Genau hier liegt der erste Kritikpunkt: Pelotons Werbung wirkt einfach unecht. An dieser Stelle sei kurz angemerkt, dass natürlich auch schlanke Personen Training betreiben, um sich fit zu halten. Jedoch stellt der Spot es so dar, dass die Ehefrau eine riesige Veränderung á la Biggest Loser durchgemacht hätte. Dem ist aber nicht so. Es stellt sich also die Frage, wieso Peloton nicht die Chance nutzte, um die Verwandlung einer echten Kundin zu zeigen, die sich nicht wohl in ihrer eigenen Haut fühlte und deshalb mit dem Training begann. Damit hätten definitiv positive Emotionen hervorgerufen und gleichzeitig die Motivation potentieller Neukunden geweckt werden können. Eine Twitter-Userin verteidigt den Spot jedoch mit einem validen Argument: Am I the only one that doesn’t see anything wrong with the @onepeloton commercial? Just because you’re skinny doesn’t mean you’re healthy. Exercise is great for mental health also. I don’t think weight was every mentioned in the commercial. #pelotoncommercial#peloton — Dani ✌ (@DaniVanHawaiian) December 4, 2019 Damit hat sie nicht ganz unrecht. Und hätte der Spot thematisiert, dass die Frau mit Hilfe des Sports einen Weg aus ihren psychischen Leiden findet, hätte er die richtige Wirkung erzielen können. Doch da diese Problematik nicht thematisiert wird, liegt der Abnehm-Gedanke näher. So oder so hätte Peloton seine Message eindeutiger machen sollen – gerade bei einem sensiblen Thema wie dem eigenen Körper. So sweet. My husband was inspired by the Peloton ad to get me a pair of pants in a child’s medium and a handwritten note that says “Don’t fucking touch me till you can fit into these” — Jess Dweck (@TheDweck) December 2, 2019 Bei diesem Punkt gehen die Meinungen auseinander, doch ein Großteil der Online Community und auch viele News-Portale sehen sexistische Züge in der Werbung. Es geht darum, dass der Ehemann seiner Frau ein Fitnessgerät schenkt – was ein Hinweis daraus sein kann, dass er sie zu dick findet und will, dass sie für ihn abnimmt. Nicht, weil sie sich selbst in ihrem Körper unwohl fühlt. Dass sie zum Training gezwungen ist, wird durch ihren Gesichtsausdruck unterstrichen, wie dieser Vergleich mit einem Charakter aus dem Horrorfilm „Get Out“ zeigt: I *knew* I’d seen that #peloton face before! pic.twitter.com/LCtn81FyOR — Honorable Rod Shaw (@aswadrodz) December 3, 2019 Gleichzeitig ist es auch verständlich, dass andere Menschen sich online über die Kritik aufregen. Es gibt tatsächlich viele Frauen, die sich einen Heimtrainer zu Weihnachten wünschen – einfach weil die Teile verdammt teuer sind und nicht jeder sich die Anschaffung unter dem Jahr leisten kann. Daran ist auch überhaupt nichts verkehrt. Jedoch ist ein Heimtrainer, ebenso wie Deos, Putzutensilien und Küchengeräte, ein eher umstrittenes Geschenk, das falsch verstanden werden kann. Die einen freuen sich, die anderen sind beleidigt. No response to that #Peloton ad will top this email I received from my husband. pic.twitter.com/gLWMUcwcdo — Kristen Baldwin (@KristenGBaldwin) December 2, 2019 Hinzu kommt, dass der Werbespot einfach ein Klischee aufgreift: Frauen sind sehr bedacht auf ihr Gewicht und müssen trainieren, um sozialen Normen und ihrem Ehemann zu entsprechen. Wieso hätte Peloton zum Beispiel nicht einen Mann zum Trainierenden machen können? Vermutlich weil die Vorstellung „unwahrscheinlich“ ist, dass er einen Heimtrainer benutzt. Wieso unwahrscheinlich? Weil in unserer Gesellschaft – vor allen in den Medien – Frauen als ständig bedacht auf ihr Gewicht und Äußeres dargestellt werden, besonders im Vergleich zu Männern. Dass das Quatsch ist, sollte jedem klar sein – spätestens nachdem man fünf Minuten lang die Muskelprotze im McFit beim Posen für Instagram beobachtet hat. Der Spot hat viele User dazu veranlasst, eine eigene, ehrliche Version davon zu drehen. Hier eines der Highlights: when my husband gets me a Peleton for Christmas …….. pic.twitter.com/Z2d3ewMhPu — Eva Victor (@evaandheriud) December 2, 2019 Was Peloton ebenfalls nicht bedacht hat, war, dass ihr Werbespot viral gehen würde. Teilweise kann so ein Shitstorm dafür sorgen, dass es zwar Kritik hagelt, die Verkaufszahlen aber trotzdem in die Höhe schießen. Doch diesmal ging die Rechnung nicht auf. Nicht nur auf Social Media sondern auch auf vielen News-Plattformen wurde über die fragwürdige Werbung berichtet – was zur Folge hatte, dass der Aktienwert von Peloton um 10 Prozent fiel. Stattdessen konnte nun aber eine andere Marke von dem medialen Skandal profitieren: Ryan Reynolds Aviation Gin. Das Unternehmen hat sich die Schauspielerin aus dem Peloton-Spot geschnappt und eine ehrliche Fortsetzung des Ganzen gedreht: Exercise bike not included. #AviationGinpic.twitter.com/jYHW74h81l — Ryan Reynolds (@VancityReynolds) December 7, 2019 Dieser Fall zeigt erneut, wie stark die Online Community ist und was ein Shitstorm für Unternehmen bedeuten kann. Ob Peloton vielleicht sogar darauf spekuliert hat, wissen wir nicht. Fakt ist jedoch, dass man gerade in der umsatzstarken Vorweihnachtszeit aufpassen sollte, wie man wirbt. Das echte Leben und echte Emotionen punkten bei den Kunden meist besser, als ein übertriebenes Idealbild. Und in diesem Sinne soll dieser Artikel mit der ehrlichsten Frage enden, die man in Bezug auf einen Heimtrainer haben kann: When is Peloton going to make an honest commercial and demonstrate how much laundry it can hold? — Todd0x1 (@todd0x1) December 2, 2019
		Netzpolitik.org	Markus Reuter	„Körper in unerwünschter Weise dargestellt“ – wie soziale Netzwerke Plus-Size-Frauen zensieren	https://netzpolitik.org/2016/koerper-in-unerwuenschter-weise-dargestellt-wie-soziale-netzwerke-plus-size-frauen-zensieren/	Reproduzieren soziale Netzwerke wie Facebook und Instagram mit Hinweis auf ihre Geschäftsbedingungen gängige Schönheitsideale und diskriminieren gleichzeitig davon abweichende Körper? Die Löschpraxis der Unternehmen zeigt, dass es durchaus ein Problem gibt. Zum wiederholten Male in wenigen Monaten haben Plattformen wie Facebook und Instagram Fotos von so genannten Plus-Size-Frauen unter Hinweis auf ihre Community-Richtlinien gelöscht. In beiden Fällen waren die Frauen in Bikinis gekleidet. Im ersten Fall ging es um eine Veranstaltung der australischen Organisation „Cherchez la Femme“, die für eine Podiumsdiskussion zum Thema Körperlichkeit mit einem Foto des Plus-Size-Models Tess Holliday werben wollte. Facebook lehnte mit Hinweis auf die Health and Fitness Policy ab – und empfahl, dass die Gruppe stattdessen ein Bild einer Person nehmen sollte, die rennt oder Fahrrad fährt. Nach Protesten durfte das Bild mit dem Plus-Size-Model später doch noch genutzt werden. In einem anderen Fall hatte Instagram ein Foto der Bloggerin Aarti Olivia Dubey gelöscht. Auch hier stellte das Unternehmen nach Protesten das Bild wieder her. Bei Instagram ist es nicht der erste Fall, der sich gegen Dicke richtet. 2014 suspendierte das Netzwerk schon einmal einen ganzen Account, und 2015 versuchte Instagram den Hashtag #Curvy verschwinden zu lassen. Was jedoch auch nach Protesten zurückgenommen wurde. Das so genannte Fat-Shaming ist kein neues Phänomen im Netz. Dass jedoch soziale Netzwerke den Beschwerden der Diskriminierenden nachgehen und Bilder löschen bzw. selbst diese Maßstäbe anlegen, ist nicht hinzunehmen. In einem anderen Fall im April diesen Jahres sperrte Facebook das Profil der für den Grimme-Preis nominierten Webseite „Anorexie – Heute sind doch alle magersüchtig“. Die Webseite hatte Bilder der Fotografin Antje Kröger auf Facebook gepostet, die auf künstlerische Weise auf Magersucht aufmerksam machen. Die Bilder, die eine nackte übergewichtige und eine nackte magersüchtige Frau zeigen, wurden mit Hinweis auf Verletzung der Community-Richtlinien („Pornografie“) gelöscht. In diesem Fall verwechselte Facebook – zum wiederholten Mal – Kunst mit Pornografie. Angesichts der marktbeherrschenden Stellung Facebooks sind solche Eingriffe in die Kommunikation direkte Eingriffe in die Meinungs- und Kunstfreiheit. Unsere Arbeit bei netzpolitik.org wird fast ausschließlich durch freiwillige Spenden unserer Leserinnen und Leser finanziert. Das ermöglicht uns mit einer Redaktion von derzeit 15 Menschen viele wichtige Themen und Debatten einer digitalen Gesellschaft journalistisch zu bearbeiten. Mit Deiner Unterstützung können wir noch mehr aufklären, viel öfter investigativ recherchieren, mehr Hintergründe liefern - und noch stärker digitale Grundrechte verteidigen! Unterstütze auch Du unsere Arbeit jetzt mit deiner Spende. Hier wird eigentlich per Skript mit unserem Spendenwidget nachgeladen. Du unterdrückst das Nachladen von Skripten und willst uns aber trotzdem unterstützen? Dann besuche unsere Spendenseite.
		Volksstimme	Gerd Roth, dpa	Westernhagen: Guter Song hat nach Jahren noch Berechtigung	https://www.volksstimme.de/musik/westernhagen-guter-song-hat-nach-jahren-noch-berechtigung/1573111697000	"Marius Müller-Westernhagen hat die Songs seines Albums ""Mit Pfefferminz bin ich dein Prinz"" neu interpretiert. Foto: Christoph Soeder/dpaChristoph Soeder ""Mit Pfefferminz bin ich dein Prinz"" ist für Fans von Marius Müller-Westernhagen ein Kult-Album. Nun hat der Musiker die Songs von 1978 völlig neu eingespielt. Warum macht er das? Berlin (dpa) - Mehr als vier Jahrzehnte liegen zwischen dem legendären Album von Marius Müller-Westernhagen (70) ""Mit Pfefferminz bin ich dein Prinz"" und der neuen Version ""Das Pfefferminz-Experiment"". Im Interview verrät der Musiker der Deutschen Presse-Agentur, was er sich bei der Neuauflage gedacht hat. Frage: Wer hatte die Idee zur neuen Interpretation des Klassikers? Antwort: Das war mein Freund und Manager Olaf Meinking. Er hat mir gesagt, welche Bedeutung dieses Album für viele Menschen hatte, was mir nicht bewusst war. Dann kam der Gedanke, wie beim Theater einen alten Stoff zu nehmen und neu zu inszenieren - nämlich total anders als zu der damaligen Zeit. Frage: Sie haben dafür musikalische Ikonen umgeschrieben, deren Klang im Kopf Ihrer Fans eingebrannt ist. Antwort: Komischerweise hat mich das nicht im Geringsten berührt. Für mich waren es einfach Songs, nachdem ich die so viele Jahre nicht gehört hatte. Erstaunlich gute Songs, das hätte ich nicht gedacht. Frage: Wie kam es zur Zusammenarbeit mit dem US-amerikanischen Musiker und Produzenten Larry Campbell, der lange Jahre mit Bob Dylan gespielt hat? Antwort: Wir haben seit ewigen Zeiten darüber geredet, dass wir unbedingt etwas machen möchten zusammen. Das sind Leute, die kannst du nicht einfach engagieren. Denen musst du Musik schicken und sagen, was du vorhast und was das ist. Larry hat mir das Gefühl gegeben, wir sind uralte Freunde. Er hat mir sofort jegliche Furcht genommen, mit diesen unglaublichen Musikern zu arbeiten. Frage: Wie lief die Zusammenarbeit? Antwort: Wir haben beide von Anfang an gesagt, dass wir in dem Album eine Wahrhaftigkeit erreichen müssen. Das soll ein total ehrliches Album ohne Maske werden. Wie ein Jazz-Album. Frage: Wie klingt das jetzt in Ihren Ohren? Antwort: Was mich überrascht hat ist, wie unglaublich man Stücke verändern kann durch Interpretation, nicht nur durch Tonhöhe und durch Rhythmen, sondern auch durch die Interpretation des Sängers kannst du ein Stück wahnsinnig verändern. Frage: Sie haben am Text keine Zeile geändert. Antwort: Nein, wollte ich auch nicht. Alle haben erzählt, das ist ein klassisches Album, das ist ein ikonisches Album. Also touchst du das nicht, machst du nicht. Das ist der Text, so wie du ihn geschrieben hast und diese Authentizität sollte es schon behalten. Frage: Funktionieren die Texte heute noch? Antwort: Erstaunlicherweise ja. Das hat mich überrascht und es hat mich auch gefreut, weil ich immer gesagt habe: Ein Song ist erst gut, wenn er nach zehn Jahren noch eine Berechtigung hat. Frage: Im ""Pfefferminz""-Song gibt es die Zeilen ""Tanzen darf ein jeder Jud'"" und ""Neger, die sind dunkel. Im Dunkeln lässt sich's munkeln."" Wie können Sie das heute noch singen? Antwort: Aus dem einfachen Grund, weil das klar als Provokation zu erkennen ist. Es ist aber nicht Provokation, um der Provokation Willen, sondern man füllt diese Provokation mit dem Inhalt. Frage: Sie sind zum zweiten Mal mit einer Afroamerikanerin verheiratet. Sie benutzen in ""Pfefferminz"" das N-Wort. Antwort: Ja, der Zeit geschuldet. Meine Frau flippt heute aus, wenn du sagst coloured, was für uns politisch über eine ganz lange Zeit korrekt war. Und auf einmal ist es das nicht mehr. Du musst heute sagen: schwarz oder black. So ändern sich die Zeiten. Ich glaube, dass man sich in jungem Alter auch nicht so viel Gedanken macht. Frage: Der Song ""Dicke"" war ironisch gemeint, wurde aber auch als fat shaming interpretiert. Was ist das für ein Gefühl, als Künstler so missverstanden zu werden? Antwort: Es gibt sicher viele Menschen, für die die Ironie nicht erkennbar war. Viele Dicke haben es als Kampfsong begriffen: ""I'm fat, I'm proud!"" Aber es gab sicher auch Menschen, die das verletzt hat und das tut mir schrecklich leid. Jetzt habe ich versucht, durch die Interpretation des Songs die Ironie sehr viel deutlicher zu machen. Frage: Gibt es einen Lieblingssong auf altem und neuem Album? Antwort: Ich habe die Alben immer insgesamt als Komposition gesehen. Es ist für mich schwer, da einen Song herauszunehmen. Der Text von ""Giselher"" hat mich immer sehr berührt und ich singe das auch wahnsinnig gerne. Frage: Der einzige Text auf dem Album, der nicht von ihnen ist. Antwort: Aber er ist großartig. Zur damaligen Zeit hatte ich das Bedürfnis, auch ein Liebeslied für einen Schwulen zu machen. Frage: Zu ""Johnny Walker"" kreisten die Whiskey-Flaschen bei Jugend-Partys. Antwort: ""Johnny Walker"" ist jahrelang auch von uns missbraucht worden. Man hat gesehen, die Leute singen da mit, und dann gibt man nochmal mehr Gas. Mir ist klar geworden, dass es ein sehr trauriger Song ist über Abhängigkeit vom Alkohol. Das hat jetzt in dieses Arrangement geführt und in diese Interpretation. Ich glaube, jetzt begreift man wirklich, was das für ein Song ist. Frage: Im Albumnamen steckt ""Vol 1"". Gibt es eine Fortsetzung? Antwort: Volume one ist eine Wunschvorstellung von mir. Es gibt noch etliche Alben, wo man sagt, die würdest du gerne noch einmal neu inszenieren. Zum Beispiel ""Das Herz eines Boxers"". Ich finde, das sind gute Songs. Ich hätte gerne die Gelegenheit, das auch noch mal aufzunehmen. Es ist einfach interessant und spannend. Zur Person: Marius Müller-Westernhagen (70) ist mit zahlreichen Nummer-eins-Alben einer der erfolgreichsten deutschen Rockmusiker. Parallel zu seiner Karriere auf den Konzertbühnen wurde er auch als Schauspieler bekannt, etwa als Fernfahrer im Film ""Theo gegen den Rest der Welt"" (1980). Westernhagen hat einen Wohnsitz in Berlin und ist in zweiter Ehe mit der US-amerikanischen Sängerin Lindiwe Suttle verheiratet. Einige hatten AC/DC schon abgeschrieben. Ein Abschied stand laut Gitarrist und Bandleader Angus Young aber nie zur Debatte. Nun meldet si... mehr › Justin Timberlake, Beyoncé, Lady Gaga, und die Rolling Stones traten schon in der Halbzeitpause des Super Bowl auf. Für kommendes Jahr kü... mehr › Die Mozartwoche soll inmitten der Corona-Pandemie Ende Januar stattfinden. Ihr künstlerischer Leiter, der Star-Tenor Rolando Villazón, si... mehr › Zum fünften Mal hat Daniel Barenboim Beethovens Klaviersonaten eingespielt. Und dabei wieder einiges entdeckt. mehr › Bleiben Sie mit unserem Newsletter immer kostenlos gut informiert!"
		esanum		Zusammenhang zwischen Übergewicht und Krebs weitläufig unbekannt	https://www.esanum.de/today/posts/zusammenhang-zwischen-uebergewicht-und-krebs-weitlaeufig-unbekannt	
22-11-2019	08:00:00Z	Deutschlandfunk Kultur		International Music Awards in Berlin - Marketingtool mit feministischem Anspruch	https://www.deutschlandfunkkultur.de/international-music-awards-in-berlin-marketingtool-mit.1013.de.html?dram:article_id=464143	
